id,name,description,wieldable,wearable,food,drink,container,surface,carryable,assigned,annotated
5019,quiet trails,"The trail meanders ahead, curving around until the path becomes hidden to the eye.",False,False,False,False,False,True,False,0,0
5021,ornate railings on the stairs,The railings are lined with gold and helped the king walk to his chambers.,False,False,False,False,False,True,False,0,0
5027,x,This crows' nest is very small and has some bird poop around and lots of emeralds inside,False,False,False,False,True,False,False,0,0
5035,very long table with ornately carved legs,The long table had carved legs that were very much over decorated.,False,False,False,False,False,True,True,1,0
5037,chairs whose legs match the table legs,The chair has intricately carved legs that look to be four ladies holding the chair up.  The wood gleams warmly as it has been carefully polished with beeswax.,False,False,False,False,False,True,False,0,0
5039,ornate throne,"With its torn seat and dusty surface, it is clear that no body sat upon it for some time.",False,False,False,False,False,True,False,0,0
5049,clothes line,The rope stretched a few feet and was at eye height. Strung tight between two metal poles.,False,False,False,False,False,True,False,1,0
5055,pew,this pew belonged to an old church. It's made out of light wood and it's very sturdy,False,False,False,False,False,True,False,0,0
5061,mosses,"Curly and soft, like a thick blanket, the moss looks like it could be a good place to rest.",False,False,False,False,False,True,True,0,0
5071,campfire burning,"The campfire has a bright red glow to it, it's flames reaching to shoulder blade height.",False,False,False,False,False,True,False,0,0
5077,ship,The ship is worn and decrepit from long battles at sea.,False,False,False,False,False,True,False,0,0
5101,gold cups,"The ornate gold cup is wide at it's stop and has a narrow base, it's gold plating embroidered with King's crest.",False,False,False,False,True,False,True,1,0
5103,silver spoons,The spoon is very tarnished and in need of polishing,False,False,False,False,False,True,True,0,0
5117,treasure chests filled to the brim with gold,The treasure chest has intricate details and can be locked.,False,False,False,False,True,False,False,0,0
5137,nests,The nest appears to be abandon.,False,False,False,False,True,False,True,1,0
5139,burrows,"It was unclear what animal carved it out, but the burrow extends far beneath the land past the sunlight's reach.",False,False,False,False,True,False,False,0,0
5141,dens,"The den was so big and made of rocks, some people were afraid to explore it.",False,False,False,False,True,False,False,0,0
5145,inkwell,"The inkwell lay tipped over, it's well stained with dried ink.",False,False,False,False,False,True,True,0,0
5147,writing desk,"The writing desk is scattered in papers, and as you move closer, you can see the surface is worn from years of use.",False,False,False,False,False,True,False,0,0
5149,parchment,The parchment is crisp with age around the edges and covered in a thin layer of dust.,False,False,False,False,False,True,True,0,0
5165,jugs,"The jug is sealed up tight, containing liquids of an unknown origin.",False,False,False,False,True,True,True,0,0
5179,bar,"The bar is empty with few customers inside, and a bit shabby in appearance.",False,False,False,False,False,True,False,0,0
5183,drinking glasses,"The glass is chipped on one side, but appears to you to be sturdy and well-made.",False,False,False,False,True,False,True,0,0
5185,steins,"The ceramic stein has once seen better days, or far too many merry days, and is now beginning to crack on it's white painted surface.",False,False,False,False,True,False,True,0,0
5187,welcome mat,A old welcome mat that has seen many travelers. The word welcome can barely be seen through all of the fading.,False,False,False,False,False,True,False,0,0
5191,rack,the rack holds many different things upon it,False,False,False,False,False,True,False,0,0
5229,mattress,The mattress is stained with blood.,False,False,False,False,False,True,False,0,0
5231,chifferobe,"The chifferobe is heavily lacquered and gleaming in the sunlight. You thought to yourself that if the chifferobe is this fancy, the items inside must be unbelieveable.",False,False,False,False,True,False,False,0,0
5245,troll's bed made of rotting hides,The troll's bed looks disease-ridden to you. The hides that make up the bed are matted and dirty.,False,False,False,False,False,True,False,0,0
5251,"vials,",The vial is partly filled with a liquid substance. You wonder what manner of strange concoctions it's contained throughout the years.,True,False,False,True,True,False,True,0,0
5253,small pot,This small clay pot has beautiful flowers drawn on one side. it's old but not cracked,False,False,False,False,True,False,False,0,0
5255,large shelf,The shelf is wooden and large. You can see that it is meant to support many heavy objects and is functional and not decorative in nature.,False,False,False,False,False,True,False,1,0
5263,roaring fireplace,The fireplace contains large logs inside its stone frame. The roaring fire licks the chimney as it expells heat.,False,False,False,False,True,False,False,0,0
5269,metal bucket,The bucket is rusted and old.,True,False,False,False,True,False,True,1,0
5271,metal meal tray,The tray is made of metal and is cool to the touch.  There are sections to put food on the tray.,True,False,False,False,False,True,True,0,0
5289,king's throne,Gold and precious jewels adorn the king's imposing throne. The seat contains one large plush red velvet cushion.,False,False,False,False,False,True,False,0,0
5299,altar,"The alter is littered with offerings, and bares an inscription in a strange, mysterious language.",False,False,False,False,True,True,False,0,0
5301,pews,The pew is made of wood and is very long.,False,False,False,False,False,True,False,0,0
5309,fire pit,The fire pit is powerful and hot. It burns with a special intensity.,False,False,False,False,False,True,False,0,0
5313,large green land,"The large green land is covered in dew, with a few muddy patches where mist has mixed with soil.",False,False,False,False,False,True,False,1,0
5315,gates,for many the gates of Hades look like the gates to a garden in which to forget all of their troubles.,False,False,False,False,False,True,False,0,0
5329,baptismal font,The baptismal font sits full of water still and clear.,False,False,False,False,False,True,False,0,0
5343,broken windows,"The window is old and coated in dust, the wood on its sill has just about rotted away.",False,False,False,False,False,True,False,0,0
5345,furniture,this piece of furniture is one of a kind.,True,False,False,False,False,True,True,0,0
5357,execution stand,the execution stand post is ready to execute the prisoners who have started the rebellion against the King,False,False,False,False,False,True,False,0,0
5363,signs,"The old wooden sign, tattered and tilted to one side, presents a stark warning to travelers -- ""Beware.""",False,False,False,False,False,True,False,0,0
5369,few rusted pieces of block,"The block seems to have had a letter engraved on it, though now you can barley make out what it is under all the rust.",True,False,False,False,False,True,True,0,0
5381,stand,The stand is a bit rickety and worn out from use.,False,False,False,False,False,True,False,0,0
5391,old machinery,The machinery has many elaborate parts and spindles.,False,False,False,False,False,True,False,0,0
5395,rock walls,"The rock wall has very little upon it, its cold surface mostly impenetrable, but a lone torch holder is fixated on it in order to provide some light.",False,False,False,False,False,True,False,0,0
5401,marbled floor,"The floor is made of an elegant marble, with shades of white and gray visible.",False,False,False,False,False,True,False,0,0
5403,floor decoration,"This floor decoration is very unique. Looks like a very expensive type of wood, very rare",False,False,False,False,False,True,False,0,0
5411,flags,The flag flaps in the wind. The streaming ends a tattered reminder.,False,True,False,False,False,True,True,0,0
5413,velvet seats,The velvet seats are smooth and brand new.,False,False,False,False,False,True,False,0,0
5421,stage,"The stage is well taken care of, and it's wooden floor is smooth and clean. It's canvas top shades it from sunlight on hot summer days.",False,False,False,False,False,True,False,0,0
5427,garden bench,Then bench is long enough for everyone to sit on.,True,False,False,False,False,True,False,0,0
5429,swing,"The swing shows some rot in the rope and seat, but still works.",False,False,False,False,False,True,False,0,0
5437,rug,The rug is ornate and detailed. You think the owner must have paid a hefty pricce for something so exquisite.,False,True,False,False,False,True,True,0,0
5459,closet,The closet is dark and contains handmade blankets and a cloak.,False,False,False,False,True,False,False,0,0
5487,wooden chair,The chair was tattered and worn after many years of use in the old theater.,True,False,False,False,False,True,False,0,0
5489,small wooden bowl,"You could tell the bowl was crafted entirely by hand without tools. Its lip was uneven, and its wall varied in thickness. But despite its misshapen appearance, it kept a man's porridge warm.",False,False,False,False,True,False,True,0,0
5493,lantern,The wooden lantern has a glass cage that served to hold a candle inside and preserve it from the elements. It has a circular bronze handle at the top to be easily carried.,False,False,False,False,True,False,True,0,0
5495,bedding,"The bedding is soft and warm, and is made out of silk and stuffed with animal feathers.",False,False,False,False,False,True,True,0,0
5497,ships,The ship is large and made out of wood. It sits in the harbor and bobs up and down in the water.,False,False,False,False,False,True,False,1,0
5499,cargo crates,A protective box used for the storage and transport of cargo.,False,False,False,False,True,False,False,0,0
5501,fishing nets,"In its tangled mess, you see a shining object.",True,False,False,False,True,False,True,0,0
5515,cases for jewels,"The outside of the case has a design of flowers painted on it. On the inside, its lined with velvet.",False,False,False,False,True,False,True,1,0
5527,empty coin bag,"The coin bag is devoid of anything of value. You knew this before even looking, but still held a small amount of hope that your fortunes has changed.",False,False,False,False,True,False,True,0,0
5533,floor,The floor is made of marble with detailed carvings of past wars.,False,False,False,False,False,True,False,1,0
5545,carpets made of silk,"The carpet is smooth and colorful. Since it is made out of silk, it is very light weight.",False,False,False,False,False,True,True,1,0
5557,cup,"The cup is old and broken, with the handle chipped from being dropped",True,False,False,False,False,True,True,0,0
5559,seats,"This seat looks to be made of some type of wood, and has been polished by many a rear resting upon it.",False,False,False,False,False,True,False,0,0
5561,pole,the pole is old and run down. there are still brackets that used to hold relevant signs years ago.,True,False,False,False,False,True,True,1,0
5565,piano,The piano has weathered keys turned yellowish from decay.,False,False,False,False,False,True,False,1,0
5567,racks,"The rack appears to be made out of iron, and it is rusty in a few places.",False,False,False,False,False,True,False,0,0
5573,huge ovens,This yellow huge oven has many cooking options.,False,False,False,False,False,True,False,0,0
5575,trash bin,The trash bin overflows with rotten vegetables and flies.,False,False,False,False,True,False,True,0,0
5577,serving platters,"The serving platter is clearly very old, but it has been polished recently and it gleams in the light.  Someone has taken very good care of this platter over the years.",True,False,False,False,False,True,True,0,0
5581,squat chair with a high back,"This chair seems a bit unusual, as it is rather low to the ground.  There are faint carvings upon its high back, which have been slowly worn away by time and much use.",False,False,False,False,False,True,False,1,0
5583,ornate desk,"This ornate desk is beautifully decorated. There are some names engraved on it, possibly the names of the kings",False,False,False,False,False,True,False,0,0
5585,bookshelves,"The bookshelves reach to the ceiling, full of worn, leather volumes of bound tomes.",False,False,False,False,True,False,False,0,0
5593,winding stairs,The stair is winding in design and seems to go on up forever.,False,False,False,False,False,True,False,0,0
5595,observation deck,A platform used to observe the scenery around the location.,False,False,False,False,False,True,False,0,0
5601,beautiful farmland,This farmland is the largest in the village and it requires many peasants to work it.,False,False,False,False,False,True,False,0,0
5605,walls,The wall is easy to climb since it is entirely made of jagged stones stacked like stairsteps.,False,False,False,False,False,True,False,0,0
5623,stove,"The stove radiates heat, the wood burning red hot within can only be described as inviting.",False,False,False,False,False,True,False,0,0
5627,trays,A heavy wooden tray is covered in scratches and stains from long use. It has handles on the side for carrying.,True,False,False,False,False,True,True,0,0
5633,hitching post,The hitching post is worn and splintered from use.,False,False,False,False,False,True,False,0,0
5643,old broken tiles,"Upon closer inspection, the tile seems coated with a mixture of candle wax and lamp oil. Whoever did this hope to cause someone pain.",False,False,False,False,False,True,True,0,0
5645,deck,The deck is made of wood and weather beaten.,False,False,False,False,False,True,False,0,0
5649,barrel of salted herring,"The heavy wooden barrel reeks of it's content, the salted herring giving off an odor most foul.",False,False,False,False,True,False,False,0,0
5661,firewood,The firewood has been chopped nicely.,False,False,False,False,False,True,True,0,0
5663,stool,The stool is sitting alone asking for someone to sit on it,True,False,False,False,False,True,True,0,0
5665,tomb,"The tomb is falling apart, and the remains inside have been disturbed.",False,False,False,False,True,False,False,0,0
5679,utensils,All of the silver utensils are polished to perfection by the kitchen staff.,True,False,False,False,False,True,True,1,0
5685,place mats,"The place mats are stained, old and mismatched.",False,False,False,False,False,True,True,0,0
5687,bowl of fruit,"The bowl has a blue glaze, and holds a large mount of grapes and other fruit.",False,False,False,False,True,False,True,0,0
5691,sandy beach,The sandy beach is occupied by the king's royal guard to defend against intruders.,False,False,False,False,False,True,False,0,0
5695,wooden platform,"The very sight of the wooden stage gives one an unnameable fear. Rising high above the ground, stairs lead up to the top.",False,False,False,False,False,True,False,0,0
5703,lush maroon carpet,The carpet is clean and decorated with an ornate pattern.,False,False,False,False,False,True,False,0,0
5711,barracks,The rickety wooden barracks display their aging wooden boards eaten through by termites.,False,False,False,False,True,False,False,0,0
5721,anvil,The anvil is hevay and black and appears to to have been well-used.,False,False,False,False,False,True,False,0,0
5725,uniforms,The uniform belongs to someone of great importance to the kingdom.,False,True,False,False,False,True,True,0,0
5731,small wooden table,The table is made of the highest quality wood.,False,False,False,False,False,True,False,0,0
5749,small pool of water,the water is clean and safe for drinking.,False,False,False,True,False,True,False,0,0
5755,jug of water,"A heavy vat made of clay, used to store water.",False,False,False,True,True,False,True,0,0
5757,cherry wood colored table,"The tabletop has smalll scratches on its surface.  Upon careful inspection, you can see that the scratches are words, but they are too faint to make out.",False,False,False,False,False,True,False,0,0
5765,serving dishes,"The dish is made of a fine porcelain, patterned with roses and swords.   A gold inlay around the rim adds a touch of majesty to an otherwise commonplace item.",True,False,False,False,False,True,True,0,0
5779,small table,The table is just large enough for four people to sit at it. The wood appears old and worn.,False,False,False,False,False,True,False,0,0
5787,wooden cranes,The wooden crane is cracked and rusty from lifting the king's heavy furniture,True,False,False,False,False,True,False,0,0
5793,unfinished navy ships,The ship is covered in barnacles as if it had been long at sea.,False,False,False,False,False,True,False,0,0
5811,targets,The target is littered with holes from past arrows that had hit their mark.,False,False,False,False,False,True,True,0,0
5819,bench made of stone,The bench seems heavy and impossible to move.,False,False,False,False,False,True,False,0,0
5821,bucket for eliminating waste,The bucket is filled with a noxious brown liquid.,False,False,False,False,True,False,True,1,0
5827,gold-laced furniture,The furniture is ornate and gold laced.  It is fit for a king.,False,False,False,False,False,True,False,0,0
5831,bed,The bed is small and narrow. It looks like it might be for a child.,False,False,False,False,False,True,False,0,0
5833,bear- and tiger-skin rugs,The rug was soft and roughly cut. You wonder what happened to the animal it came from.,False,False,False,False,False,True,True,0,0
5841,basket,Such a worn out basket. It can barely hold all the fresh-caught fish. It has mold on it and it's broken in many parts,False,False,False,False,True,False,True,0,0
5843,"piece of old, sun-bleached sailcloth","It could be a very old piece this piece of cloth, maybe it was worn by someone important or has a story",False,False,False,False,False,True,False,0,0
5845,fish tank,"The empty fish tank is covered in dust and broken at the bottom, unable to hold water.",False,False,False,False,True,False,False,0,0
5867,small bucket,The bucket may be small but it gets the job done.,False,False,False,False,True,False,True,0,0
5869,more-than-king-sized bed,"looking twice at the bed, surprisingly it is more than a king sized bed",False,False,False,False,False,True,False,0,0
5873,lavish desk piled high with books.,The lavish desk is piled high with books that looked like they have seen years of use.  The leather bindings are cracked and the pages are yellowed and torn.  Under the books the desk has a beautiful maple top that reflected the sunlight from the window.,False,False,False,False,False,True,False,0,0
5875,chair,"The chair is inviting, but it is not the time to sit for a rest.",False,False,False,False,False,True,False,0,0
5879,chamber pot,"The chamber pot smells terrible, like it has only been hastily emptied and not cleaned.",False,False,False,False,True,False,True,0,0
5907,large ornate table,"The table has a highly polished surface, ornately lathe-turned legs and intricate floral carvings along the edge of the tabletop.",False,False,False,False,False,True,False,0,0
5909,smaller tables,The table is low and small.  It looks like it could be used as a dinner table for a small child.,False,False,False,False,False,True,False,0,0
5911,higher dining table,"The table stood as well as it could, as one leg was noticeably well worn out.",False,False,False,False,False,True,False,0,0
5917,golden goblet,The goblet is made of fine gold and is very well made.,False,False,False,False,True,False,True,0,0
5919,stained glass windows,The glass window is old and dusty with small pieces of glass falling out,False,False,False,False,False,True,False,0,0
5923,musty shelf,The shelf is worn and its nails are coming loose from the wall.,False,False,False,False,False,True,False,0,0
5929,table,The table is large and made of wood.,False,False,False,False,False,True,False,0,0
5933,bridge,The bridge has a few missing boards and looks like it might not be safe to cross.,False,False,False,False,False,True,False,0,0
5937,benches,"The bench is wooden and has seen better days. The old grain makes the surface rough, and it is beginning to splinter.",False,False,False,False,False,True,False,0,0
5939,fountain,The fountain is beautifully sculpted with water flowing down it's ridges. Who knows what tales the water has seen unfold.,False,False,False,False,True,False,False,0,0
5951,wooden bowls,"A small, wooden bowl catches your eye.  Though appearing plain at first, it is imprinted with a symbol that looks incredibly familiar.",True,False,False,False,True,False,True,0,0
5965,chimney,The chimney is dirty and messy,False,False,False,False,True,False,False,0,0
5967,dinner table,The table is small and square. It is sturdy and has different shades of brown.,False,False,False,False,False,True,False,0,0
5969,silks,The silk has many colors and is very soft to the touch.,False,True,False,False,False,True,True,0,0
5971,huge bed,"This bed could easily fit a family of four on it, it is quite massive.",False,False,False,False,False,True,False,0,0
5977,brook,"This brook burbles cheerfully, and looks crystal clear and very refreshing.",False,False,False,False,True,False,False,0,0
5981,small wooden bed,"this small wooden bed is clothed in warm cotton blankets. it has a homely feel, and seems to be slept in by a small child",False,False,False,False,False,True,False,0,0
5983,colorful homemade quilt,"The quilt's colors are bright and vibrant, singing a song of praise to its creator.",False,False,False,False,False,True,True,0,0
5985,small wooden cabinet,The cabinet has two wide doors on the front concealing a shelf inside. It is made entirely of oak wood.,False,False,False,False,True,False,False,0,0
5993,straw mattress,"The mattress is worn down, and may have bed bugs.",False,False,False,False,False,True,False,0,0
5995,comfortable chair,"This chair is crafted of wood, and looks to be carved to perfectly accommodate anyone who might sit in it.  It seems the sort of chair you could spend many an hour in.",False,False,False,False,False,True,False,0,0
6001,bed,The bed is made and seemed be untouched since morning.,False,False,False,False,False,True,False,0,0
6015,beakers and potions,The beaker bubbles and the potion undergoes a strange reaction.,False,False,False,False,True,False,True,0,0
6019,huge vat of brewing liquid,The huge vat of brewing liquid is boiling over.,False,False,False,False,True,True,False,0,0
6029,small fountain,"The fountain is built of large stones, smoothed by time and water. It stands as tall as a man and is wide enough for several people to access it at once.",False,False,False,False,True,False,False,2,0
6039,walls,The wall appears to be heavily damaged. There are chips and holes throughout.,False,False,False,False,False,True,False,1,0
6041,torture rack,The dried blood upon the rack is mortifying.,False,False,False,False,False,True,False,0,0
6043,crooked stone chimney,It is thick with soot. You may find something hidden if you look into the dark interior.,False,False,False,False,True,False,False,0,0
6049,large four poster bed,Such a sturdy large four poster bed. The metal frame is a bit rusty but still looks fancy,False,False,False,False,False,True,False,0,0
6051,finest linens,The linen is very soft to the touch and has a carefully embroidered pattern.,False,False,False,False,False,True,True,0,0
6063,large chest of drawers,"The chest contains six drawers, each with a brass knob in the center.  The wood is polished and shining.",False,False,False,False,True,False,False,0,0
6071,wooden spit,The wooden spit shows signs of repeated use.,False,False,False,False,False,True,True,0,0
6075,colorful lizard,"There are so many hues of green on the lizard, it can't easily blend in with many trees and plants.The lizard's neon yellow skin is so bright that it is impossible for it to camouflage itself in the wild.",False,False,False,False,False,True,False,0,0
6077,cups,The cup is brown and made of hardened clay.,False,False,False,False,True,False,True,0,0
6083,wooden cups,"The cup has a wide base, carved into a lion's paw. The drawings on the side are intricate; whoever worked on this put in a great deal of effort.",False,False,False,False,True,False,True,0,0
6103,stretched canvas,"The canvas lay bare, waiting for the painter to begin his work.",False,False,False,False,False,True,True,0,0
6115,baby bassinets,A bassinet is woven from strands of fine linen.,False,False,False,False,True,False,False,0,0
6123,boxes,It's a cubical box with a crest on the side.  It looks perfect for storing all kinds of items.,False,False,False,False,True,False,True,0,0
6125,cabinet,The cabinet contains dishes and cups and is very dusty.,False,False,False,False,True,False,False,0,0
6153,silk pillows,"A dark red liquid has stained the king's large, purple silk pillow.  It appeared to be either blood or red wine.",False,False,False,False,False,True,True,2,0
6157,wooden cart,The wooden cart has a platform made from sturdy worn boards. Its large wheels keep it from getting stuck in the mud.,False,False,False,False,False,True,False,0,0
6161,hard wooden chair under the eaves,"This hard wooden chair under the eaves is made out of pine, it has wine stains on it, also it's all scratched up",False,False,False,False,False,True,False,0,0
6167,docks,The dock is large and sturdy against the coming tides.,False,False,False,False,False,True,False,0,0
6171,buckets,The wooden bucket is beginning to warp and you don't know whether it will hold water or not.,False,False,False,False,True,False,True,0,0
6179,broken pottery,The broken pottery's artwork is unrecognizable. What was once a piece of art is now just shards of colorful figures.,True,False,False,False,True,False,True,0,0
6193,basin,The basin is stained from use and one of the handles seems to be broken.,False,False,False,False,True,False,True,0,0
