id,name,description,wieldable,wearable,food,drink,container,surface,carryable,assigned,annotated
6211,nice fruit trees,the fruit tree bears many fruits at this time,False,False,False,False,True,False,False,0,0
6215,incense holders,The incense holder is covered in ashes.,False,False,False,False,True,False,False,0,0
6219,wood aisles,The aisle is between the rows of seats. It is wide enough for three men to walk abreast.,False,False,False,False,False,True,False,0,0
6221,big wooden table,"The table is large, with rough boards and a few knot holes in the wood.",False,False,False,False,False,True,False,0,0
6223,scale,The alchemist's scale was made of solid gold.,False,False,False,False,False,True,True,1,0
6225,porcelain vase,The vase is made of porcelain and contains beautiful engravings and patterns.,False,False,False,False,True,False,True,0,0
6229,basket of grain,The basket has a leather-hinged lid to keep its contents secure. The inside is large and would hold a great deal.,False,False,False,False,True,False,True,0,0
6237,small lake,The lake is a bit murky in terms of its waters but seems to be mostly calm.,False,False,False,True,True,False,False,0,0
6245,bathroom pot,The notorious pot holds a stale liquid.,False,False,False,False,True,False,True,0,0
6251,well,The well is worn out. Those who once used it are gone.,False,False,False,False,True,False,False,0,0
6263,stall,"It is tall and rather dusty, like nobody has sat on it for a while.",True,False,False,False,False,True,False,0,0
6269,pail,The pail is old and beginning to rust in places.,False,False,False,False,True,False,True,0,0
6291,broken lanterns,The lantern's glass that once protected the candle is broken and the wood itself is splintered and worn.,False,False,False,False,True,False,True,2,0
6313,beach,The meeting of sandy shores with dancing blue water. This beach has been around for ages.,False,False,False,False,False,True,False,0,0
6315,large and well stocked wine rack,The rack is being used to store an extensive collection.,True,False,False,True,False,True,False,0,0
6317,luxuriously soft couch,The couch has a velvet soft covering that shimmers under the light.,False,False,False,False,False,True,False,0,0
6323,green short grass,The short grass feets good under your feet and the green reminds you of spring.,False,False,False,False,False,True,False,0,0
6327,small alter,The alter has darkened with age and small amounts of splinters can occasionally be seen.,False,False,False,False,False,True,False,0,0
6331,empty gruel bowl,Grit and grime cake the edges of the heavily used bowl.,False,False,False,False,False,True,True,0,0
6335,oak pews,The oak pew looks like it has been here for many decades.  Someone has carved their initials in the seat.,False,False,False,False,False,True,False,0,0
6339,large table,"The table is large and heavy, with thick legs and a solid top.",False,False,False,False,False,True,False,0,0
6341,simple wooden table,The table is light in color and made from a common wood. It seems relatively new.,False,False,False,False,False,True,False,0,0
6347,single shelf,The shelf is sturdy and made of wood.  A few items sit on the dusty shelf.,False,False,False,False,False,True,False,0,0
6363,rough stone floor,The floor is well worn with uneven stones.,False,False,False,False,False,True,False,0,0
6367,furniture,The furniture is wooden and handcrafted.  It is sturdy.,False,False,False,False,False,True,False,0,0
6381,water wells,"The well is deep and dark; a cool breeze rises up from its depths.  Looking down, you can see the gray slime that has formed on its close-fitting stone sides.",False,False,False,True,True,False,False,0,0
6397,loft,"It's a cozy looking, well kept loft.",False,False,False,False,False,True,False,0,0
6413,big organ,This massive organ has gleaming brass pipes and a beautiful oak finish.  it is extensively carved with various woodland scenes and is well polished.,False,False,False,False,False,True,False,0,0
6417,altar,"The altar, made of fine marble, is humbled by blood stains.",False,False,False,False,False,True,False,0,0
6451,forge,"The forge is dark and steamy with a musky scent.  It is mysterious and enchanting, repelling the observer while pulling them in.",False,False,False,False,True,False,False,0,0
6453,wooden workbench,"This workbench looks quite worn from years of use, and has odd divots in the wood where a project might have gone astray.",False,False,False,False,False,True,False,0,0
6483,shrine,"The shrine is meticulously clean, and it holds a few offerings and some incense.",False,False,False,False,False,True,False,0,0
6503,expensive carpet,A carpet made of the finest silk and with intricate patterns woven in.,False,False,False,False,False,True,True,1,0
6511,wooden chest,the wooden chest contains the special items of the man's past.,False,False,False,False,True,False,False,0,0
6517,guard's toilet basin,You see a rancid toilet basin. Its stench fills the air.,False,False,False,False,True,False,False,0,0
6533,fire pit,The fire pit is rather large and can be used.,False,False,False,False,True,False,False,1,0
6535,fountain,"The fountain flows red with the blood of soldiers.  The stone is stained red, and no water emerges from the spout.",False,False,False,False,False,True,False,0,0
6541,jar of seeds,"The jar contained an assortment of seeds, varying in size and color. But unlike the seeds, which had long expired, the dusty jar is certain to be given a second life in the future.",False,False,False,False,True,False,False,0,0
6543,money box,The money box is made of hard steel and looks like it could withstand an attack from any weapon imaginable.  A rusted padlock secured the lid.  It looks like it hasn't been opened in ages.,False,False,False,False,True,False,True,0,0
6549,land,"Vast green reaches as far as the eye can see, the land is well preserved and manicured.",False,False,False,False,False,True,False,2,0
6553,grimy stools,This stool is old and dusty and has a broken leg,False,False,False,False,False,True,False,0,0
6555,wooden bar,"The bar is old, but still has plenty life left in it. Passed down through generations, it's surface is adorned in scratches, knife marks, and name carvings that add a sense of beauty and immeasurable value to the aging piece.",False,False,False,False,False,True,False,1,0
6563,wooden tables,The table is old and broken with scratches on the surface.,False,False,False,False,False,True,False,0,0
6567,candy shop,"The shelves in the candy shop are stocked with caramel, fudge and peppermint.   The doors are open on this hot summer day and the candy can be smelled a block away.",False,False,False,False,True,False,False,0,0
6571,roads,"The road is dusty, desolate and eerie.  It has a sense of danger around every corner.",False,False,False,False,False,True,False,0,0
6573,streets,"The street is made of cobblestone, one of the first of its kind.",False,False,False,False,False,True,False,0,0
6575,cobblestones,The cobblestone is hard and cool to the touch. It has traces of dirt and grass all over.,False,False,False,False,False,True,False,0,0
6577,well,The well in the center of town is the best source of information around.,False,False,False,False,True,False,False,0,0
6581,cargo,The cargo is stacked up neatly.,False,False,False,False,True,False,True,0,0
6587,wooden cabinets,The cabinet is made out of oak. It is filled with plates and glasses.,False,False,False,False,False,True,False,0,0
6591,basin for water,"The pottery basin is chipped on one side.  Upon closer inspection, you see that it is also cracked.",False,False,False,False,True,False,True,0,0
6611,steering wheel,It is obvious this steering wheel had been used many times.,False,False,False,False,False,True,False,0,0
6617,wooden floor,"A flat surface for walking, made of oddly shaped boards, which were strategically fit together.",False,False,False,False,False,True,False,0,0
6625,wine glasses,the wine glass has a lovely shape.,False,False,False,False,False,True,False,1,0
6627,coffins,The coffin is clearly very old and covered in a layers of dust.,False,False,False,False,True,False,False,0,0
6633,wood flooring,An expanse of wooden boards that have been cut to fit together.,False,False,False,False,False,True,False,0,0
6639,big bed,"The bed creaks easily, its wooden headboard worn smooth by years of use.",False,False,False,False,False,True,False,0,0
6655,sitting bench,Upon closer inspection one can see the bench is in need of repair.  Weather has taken its toll.,False,False,False,False,False,True,False,0,0
6657,fountain,"Though it still looks like it could, the fountain is no longer working.",False,False,False,False,True,False,False,0,0
6659,wooden bed,A simple wooden rectangle with a grid of interwoven ropes to support a mattress.,False,False,False,False,False,True,True,0,0
6667,woven blue rug,The rug is the color of the ocean.  It looks soft and inviting.,False,False,False,False,False,True,True,0,0
6669,desk,"This desk looks to be quite sturdy, and has a number of ink and wax stains on it.",False,False,False,False,False,True,False,0,0
6673,fire pits,The fire pit is hot and bright. Whoever made it did an excellent job.,False,False,False,False,False,True,False,0,0
6677,altar,The altar is made of wood and looks well worn.,False,False,False,False,False,True,False,1,0
6683,draw bridge,The draw bridge is open but don't expect as much openness from the people on the other side of it.,False,False,False,False,False,True,False,1,0
6709,pots,"The dusty, clay pot is artistically crafted into the form of a slender woman, seductive and enchanting to behold.",True,False,False,False,True,False,True,0,0
6711,plates,the plate is exceptionally colorful and interesting,False,False,False,False,False,True,True,1,0
6737,chalice,The chalice is made of solid gold. It appears to have some wine stains along the rim.,False,False,False,False,True,False,True,0,0
6751,pulpit,The pulpit is made of fine wood and has papers of the old priests speeches on it,False,False,False,False,False,True,False,0,0
6753,tithe plate,"A shallow plate, but wrapped in gold, the tithe plate serves to host the devious church goers offerings.",False,False,False,False,True,True,True,0,0
6767,large bed,The large bed had seven pillows on it.,False,False,False,False,False,True,False,0,0
6779,large wardrobe,"The wardrobe is made from solid oak and stained a rich, dark brown.",False,False,False,False,True,False,False,0,0
6837,two home made wooden crosses,the cross has nails stuck on it.,False,False,False,False,False,True,True,1,0
6843,elaborate carpet pieces,"The carpet piece is beautifully colored with red, purple and silver hues.",False,False,False,False,False,True,False,1,0
6847,wooden pews,The pew is weather-worn and splintery.  You don't think it would support your weight.,False,False,False,False,False,True,False,0,0
6849,brick walls,"The brick wall is so old and dirty, it seems to have been here for quite a while.",False,False,False,False,False,True,False,0,0
6865,pink and white outline,"The outline of the object, pink and white in color, remained on the ground.",False,False,False,False,False,True,False,1,0
6879,wooden stool,The stool is old and uneven.,False,False,False,False,False,True,True,0,0
6887,kettle,"The kettle has a large dent on one side, and is scratched in a few places.",False,False,False,False,True,False,True,1,0
6889,small bed,"A source of comfort for weary, this bed has layers of woolen blankets, and a straw mattress.",False,False,False,False,False,True,False,0,0
6893,desk,The desk is made of sturdy oak but is very low to the floor.,False,False,False,False,False,True,False,1,0
6895,desk chair,The desk chair is well worn. It is clear someone spent many a days completing work while sitting there.,False,False,False,False,False,True,True,0,0
6901,polished gold,A beautiful goblet of gold. It is quite heavy in the hand and looks to have been made by a master of their craft.,False,False,False,False,True,False,True,0,0
6915,barrels for crops,The barrel is made out of oak and supposed to hold crops for the week.,False,False,False,False,True,False,True,1,0
6919,watering bucket,"The bucket's many holes, cracks and splintered panels were all signs indicating that it had long outlived its usefulness to the farmer.",False,False,False,False,True,False,True,0,0
6923,dirty trail,"The trail is long, winding, and covered in mud.",False,False,False,False,False,True,False,1,0
6935,mattresses,"All of the mattresses are stiff and lumpy, providing no comfort.",False,False,False,False,False,True,False,1,0
6937,gallows,The gallows is an ominous sight for all who passed by it. A large contraption of wood and rope with only one purpose. Hanging.,False,False,False,False,False,True,False,0,0
6949,double thick wooden door,After looking closely this door is a double door and it is made of wood.,False,False,False,False,False,True,False,0,0
6955,ornate chairs,With hand-carved lion faces and coat of arms and a frame made of solid mahogany the ornate chair is fit for royalty.,True,False,False,False,False,True,False,0,0
6995,water troughs,The wooden trough is broken from holding the heavy water and grass,False,False,False,False,True,False,False,0,0
7001,small gazebo,This small place is perfect for merryiment and joy.,False,False,False,False,False,True,False,1,0
7005,trash bins,"The trash bins are in a row, some appeared empty.",False,False,False,False,True,False,True,0,0
7037,beds,"The bed is elevated off the ground, but still shows signs that something had chewed through it.",False,False,False,False,False,True,False,1,0
7041,altars where they kneel in prayer,The altar is ornate and highly polished. The woodwork gleams.,False,False,False,False,False,True,False,0,0
7049,trapdoor,The evil lord had a trapdoor installed in his great room.,False,False,False,False,False,True,False,0,0
7057,rivets,The rivet is made of metal. It may be useful for binding objects together.,False,False,False,False,False,True,False,0,0
7065,jars of mysterious reagents,"The jar was old and bore markings in a strange, unknown language.",False,False,False,False,True,False,False,1,0
7075,flasks,The small flasks contain a liquid that could only be described as intoxicating.,False,False,False,True,True,False,True,0,0
7079,purses,This purse is pretty small. It's made out of alligator skin and it looks pretty old but still has a lot of life left,False,True,False,False,False,True,True,0,0
7089,red silk prayer bench,The bench is used for prayer and is covered with a lovely red silk fabric.,False,False,False,False,False,True,False,0,0
7107,sheets,The bedroom sheets are old and dirty after not being ished for months,False,True,False,False,False,True,True,0,0
7115,"simple wooden bucket for holding umbrellas, walking sticks, etc",The wooden bucket is well worn. It has been used to carry a variety of items and water over a period of many years.,False,False,False,False,True,False,True,0,0
7131,well,"the wishing well is dry, which doesn't give one the best sense of having their wishes granted.",False,False,False,False,True,False,False,0,0
7133,copper vase,The vase is made of copper and has been polished to a high shine.,False,False,False,False,True,False,True,0,0
7137,animal skins used as rugs,"The animal skins were remarkably clean, but came from an animal you did not know.",False,True,False,False,False,True,True,0,0
7159,machines,"The machine of war is devestating. Large stones sit inside it, waiting to be launched.",True,False,False,False,False,True,False,0,0
7163,pamphlets,The pamphlet is made out of paper and has a lot of information inside it.,False,False,False,False,False,True,True,0,0
7165,heavy trunk,"The trunk is heavy and the wood painted a deep black. It has a gold lock on it, and you cann't help but wonder what treasures it contained.",False,False,False,False,True,False,False,0,0
7169,polishing cloth,The polishing cloth is covered in dark polish.  It is tattered and frayed as though it has been used for several years.,False,True,False,False,False,True,True,0,0
7171,clothes brushes,"The cloth was clean and bright in all its colors, stealing it comes to mind.",False,True,False,False,False,True,True,1,0
7175,pans,"The pan is rusty, not having been ished in sometime",True,False,False,False,True,False,True,0,0
7183,computer,"The computer, also known as an abacus, is a wooden square with faded paint delicately holding metal rods and sliding beads.",False,False,False,False,False,True,True,1,0
7191,headstones,"Here are the headstones, in this sacred field, where lie the heroes who gave their lives, so that this kingdom would survive before the fiefs that wanted to plunder it and take advantage of its wealth.",False,False,False,False,False,True,False,0,0
7197,seat,The seat is dirty with the blood from the farmers.,False,False,False,False,False,True,False,0,0
7201,golden cloth,The cloth is gold and shimmers when moved in light.,False,True,False,False,False,True,True,0,0
7215,small metal bucket,"The metal bucket appears to be made of copper, with multiple dents and scratches on the the surface.",True,False,False,False,True,False,True,0,0
7221,food tray,"A simple tray, to put one's food on.",False,False,False,False,False,True,True,1,0
7223,boats floating,"The boat is old, gnarled, and rotted, and smells of spoiled fish.",False,False,False,False,True,False,False,0,0
7227,bait bucket,"The bucket is raw with the smell of fish, it has darkened with age",False,False,False,False,True,False,True,0,0
7233,huge window in the front,The large window is clear with minimal distortion.,False,False,False,False,False,True,False,0,0
7245,blue floors,The floor has a blue color that is faded because of its old age and lack of upkeep.,False,False,False,False,False,True,False,0,0
7263,kettles,The kettle is warm with boiling water in it.,False,False,False,False,False,True,True,0,0
7287,marble floor,This floor shines as if it has never seen the bottom of a dirty boot.,False,False,False,False,False,True,False,0,0
7289,shrubbery,The shrubbery stands about waist high. Its thick green foliage conceals a small animal nest.,False,False,False,False,True,False,False,0,0
7301,music organ,"The organ is severely out of tune, so it must not be used often.",False,False,False,False,False,True,False,0,0
7307,makeshift stall,The quickly made stall was very unstable and not very well built.,False,False,False,False,True,False,False,0,0
7317,haystacks,A large pile of wheat stalks that emit a musty farmyard fragrance.,False,False,False,False,False,True,False,1,0
7339,blankets for the stable workers to sleep with,"The blanket is dirty and stained, and has a musty smell to it.",False,True,False,False,False,True,False,0,0
7343,altar,The alter is sacred and inscribed with religious words.,False,False,False,False,False,True,False,0,0
7345,offering plate,The offering plate is made of gold and several gold pieces sit atop it already.,False,False,False,False,False,True,True,0,0
7349,sand that is white as snow,"Whether bleached by the sun or made of white shells, this sand is pristine and unblemished.",False,False,False,False,False,True,False,0,0
7359,cast iron skillets,"The black skillet is nicely seasoned, not showing any rusted spots.",True,False,False,False,False,True,True,1,0
7371,broken chairs,"The chair is broken, with the back almost completely separated from the seat.",False,False,False,False,False,True,False,0,0
7389,hard bench,"The hard bench appears to be crafted from solid oak, with a gold base in the shape of bird feet.",False,False,False,False,False,True,False,0,0
7393,large dark oak and gold bench,"The bench is very large and made of oak, and has been decorated with great intricacy. The golden carvings seem to hint at the wealth of its owner.",False,False,False,False,False,True,False,0,0
7397,forest trees.,The tree seems healthy and large. It should prove to be climbable.,False,False,False,False,True,False,False,0,0
7399,wood is gathered to make fire,"The wood lay scorched on the ground, and warm to the touch.",False,False,False,False,False,True,True,0,0
7407,horse trough,The horse trough is already empty and it surprised you.,False,False,False,False,True,False,False,1,0
7419,cookpot,"The cookpot is large, heavy, and round. Peering inside, you have trouble seeing the bottom.",False,False,False,False,True,False,True,0,0
7421,shelf,The shelf is sturdy and held in place with rusty iron brackets.  It held a collection of vials and potions.  The bottles are dusty and looked like they've been there for years.,False,False,False,False,False,True,False,1,0
7429,stacks of gold plates,The plate is made of glass and is white with a gold rim around it.,False,False,False,False,False,True,True,1,0
7441,ice goblet,"This goblet is freezing cold to the touch and, while it might keep whatever liquid is inside it very cold, it might also cause your hands to get frostbite.  It seems to shimmer gently as you look upon it.",False,False,False,False,True,False,True,0,0
7463,barn,The barn is huge and red in color!,False,False,False,False,True,False,False,1,0
7465,jars,The jar seems to have a crack on it. I don't think you can use it anymore.,False,False,False,False,True,False,True,0,0
7473,wooden table,A simple table crafted of rough brown wood.,False,False,False,False,False,True,False,0,0
7475,cabinet,A cabinet stood out painted pitch black.,False,False,False,False,True,False,False,0,0
7483,mahogany writing desk,"Beautiful and dark, the solid rectangular desk has ten drawers, ornate golden pulls and a heavily polished surface.",False,False,False,False,False,True,False,0,0
7485,chamber pot,"Since there is no plumbing in the kingdom, the townspeople have open chamber pots in their homes to excrete waste into.",False,False,False,False,True,False,True,0,0
7487,vanity,The vanity is made from the finest oak in all the realm. The designs on the sides are of the royal insignia.,False,False,False,False,True,False,False,0,0
7491,quiver,"The quiver contains a mess of arrows, its leather frame stretched from years of use.",True,False,False,False,True,False,True,0,0
7497,chairs,"Among numerous scratches on its surface, you can make out some marking.",True,False,False,False,False,True,False,0,0
7501,gold plated dome,A giant cross sits atop the gold plated dome.,False,False,False,False,False,True,False,0,0
7505,hand carved 30 person kings dining table,A piece of furniture used to set food on while you eat.,False,False,False,False,False,True,False,0,0
7507,hand woven rug,"You admire the colorful pattern of the hand woven rug, with hues of intense blues and greens.",False,False,False,False,False,True,False,0,0
7513,jug that holds the wine the servants fill glasses with,The jug is very useful for filling glasses of tea at dinner.,True,False,False,False,True,False,True,0,0
7523,"old machinery lying around, rusting",The machinery is obviously no longer in working condition,True,False,False,False,False,True,False,1,0
7527,mining carts,The mining cart has seen better days. It is old and battered.,False,False,False,False,True,False,False,0,0
7537,gardens,"The aroma of the garden is relaxing and refreshing, with the plants giving off an assortment of various colors.",False,False,False,False,True,False,False,0,0
7547,screen,The screen is semi-transparent and has a few holes here and there.,False,False,False,False,False,True,False,0,0
7549,wood stools,The stool is sturdy and made of wood.  The seat is made of leather.,False,False,False,False,False,True,True,0,0
7555,stone bench,The stone benchis so sturdy and can last a lifetime.,False,False,False,False,False,True,False,0,0
7559,flowerpots,The ceramic flowerpot contains tulips picked from the outside garden,False,False,False,False,True,False,True,0,0
7569,bookshop,"The bookshop is covered from floor to ceiling in full bookshelves, and the air of it filled with the scent of leather bindings and old paper.",False,False,False,False,True,False,False,0,0
7577,steel statue,The steel statue looks like it has seen better days. It's all dirty and has marks all over it.,False,False,False,False,False,True,False,0,0
7591,soft bed,This bed is very small but so ridiculously soft. It looks brand new which is weird because it's 245 years old,False,False,False,False,False,True,False,0,0
7597,wardrobe,"The wardrobe is made of high quality woods, intricate designs have been carved on its surface.",False,False,False,False,True,True,False,0,0
7609,pew bench,The pew was made of dark oak and was lined with red royal satin.,False,False,False,False,False,True,False,0,0
7613,handmade rug,The rug is decorated in a intricate striped pattern and is obviously the work of a fine craftsman.,False,False,False,False,False,True,True,0,0
7617,goblets,This goblet is made out of high quality glass. Some initials are engraved on the side,False,False,False,False,False,True,True,0,0
7619,fur skin rug,This fur skin rug used to be in a hunter's bedroom. It's made out of a brown bear,False,False,False,False,False,True,False,0,0
7621,beaten copper pot,"The copper pot shows years of use, with the copper color beginning to warp on the handle. There are dents throughout the body as well.",False,False,False,False,True,False,True,0,0
7627,chairs,the chair is royal in nature and has engravings and decor all over. it is clear only someone of worth is allowed to sit in it,False,False,False,False,False,True,False,0,0
7641,wooden counters,The counter was messy and reeked of a foul stench.,False,False,False,False,False,True,False,0,0
7645,pot,"The pot is old and cracked, with rust covering the outside.",False,False,False,False,False,True,True,0,0
7649,cupboard,"The cupboard is filled with all manner of dishware, its handles long worn down from constantly being opened and closed.",False,False,False,False,True,False,False,0,0
7657,cloth sacks,The stained cloth sack has holes cut out for arms to fit through.,False,True,False,False,True,False,True,0,0
7659,big table,The table is large enough for 50 people.,False,False,False,False,False,True,False,0,0
