id,name,description,wieldable,wearable,food,drink,container,surface,carryable,assigned,annotated
7661,empty mug,The mug has been used for tea for a very long time.,True,False,False,False,True,False,True,0,0
7665,shelves,The shelf is made of dark rough-hewn wood and is large enough to hold several books or bowls.,False,False,False,False,False,True,False,0,0
7671,money register,The register is complex.  It has several buttons and keys.,False,False,False,False,True,False,False,0,0
7677,carpets,A decorative tapestry placed on the floor. Stylized and decorative.,False,False,False,False,False,True,False,0,0
7681,tomb,"The tomb is filled with cobwebs. It has a dank, musty smell, and water dripped from the walls.",False,False,False,False,False,True,False,0,0
7691,cooking pot,"A large bellied vessel for making vast portions of hearty stews, and boiling laundry.",False,False,False,False,True,False,True,0,0
7719,bucket,"The bucket is wooden, with a rope handle. It is starting to crack on one side.",False,False,False,False,True,False,True,0,0
7723,trash bags,The bag is full of stench and blood.,False,True,False,False,True,False,True,0,0
7731,crates,"This crate looks to be made of leftover wood scraps, as it looks like it is barely holding together.  Hopefully it does not need to travel very far.",False,False,False,False,True,False,False,0,0
7747,dunes,"The dunes are massive, and have many strange animals living in them.",False,False,False,False,False,True,False,0,0
7813,cement,The cement is of the highest quality for the castle that will be built later.,False,False,False,False,False,True,False,0,0
7815,cup,the cup is red in color.,False,False,False,False,True,False,True,1,0
7825,ornate chandeliers,"The chandelier is new and crafted by hand. It's polished gold arms reflected the awe-struck faces of the queen's guest as they sat under the massive, jewel encrusted ornament in anticipation of the royal dinner.",False,False,False,False,False,True,False,0,0
7827,golden tables,"The table is crafted out of fine oak, but plated in gold in a lavish design fit for a king.",False,False,False,False,False,True,False,0,0
7829,gold clothing,"The gold clothing shimmers in the light, symbolizing the wealth and prosperity required to own it.",False,True,False,False,True,False,True,1,0
7839,long wooden tables,This wooden table is long enough to place lots of food for our picnic.,False,False,False,False,False,True,True,0,0
7843,huge cast iron pot,The pot is large and black.  A large meal can be cooked in the pot.,False,False,False,False,True,False,True,0,0
7877,treasure map,The map shows the forest and the river clearly labeled. It is marked with a mysterious black X.,False,False,False,False,False,True,True,0,0
7881,velvet seats,The velvet seat was soft to the touch.,False,False,False,False,False,True,False,0,0
7889,extravagant rugs,"The rug is thick and plush, with a fancy pattern of scrollwork and flowers.",False,False,False,False,False,True,False,0,0
7893,ornate plates,The ornate plate is ceramic and decorated with gold leaf on it's perimeters in a design reminiscent of a vine.,False,False,False,False,False,True,True,0,0
7911,vinyl booths,This booth looks somewhat out of place in this medieval setting.,False,False,False,False,False,True,False,0,0
7913,white counter top,"The counter top is painted in a milky white, and covered in many scratches from years of being used as a cutting surface.",False,False,False,False,False,True,False,0,0
7965,cast iron and copper pots,The pot is old and can only hold food such as chicken clearly.,False,False,False,False,True,False,True,0,0
7975,road,The long and winding road is narrow.,False,False,False,False,False,True,False,0,0
7981,market stalls lining the streets.,As you walk through the market corner the you notice that the stalls are worn and a bit weathered but filled with many wares from all over the realm.,False,False,False,False,True,False,False,1,0
8005,fences,The fence is easily broken into and should not be trusted.,False,False,False,False,False,True,False,0,0
8019,crumbling headstones,The headstone is old and the stone is crumbling away in some places.  The name can barely be made out.,False,False,False,False,False,True,False,0,0
8041,balcony,What a huge and clean balcony. There are two chairs on it and some flower pots,False,False,False,False,False,True,False,0,0
8045,flower pot,the pot is made of clay.,False,False,False,False,False,True,True,0,0
8047,plate,The plate is crafted from pure gold and ivory.,True,False,False,False,False,True,True,0,0
8055,tombs for every empress and emperor,The tomb is decorated with many fine riches. You wonder who might deserve such a place.,False,False,False,False,True,False,False,0,0
8057,personalized tomb,The tomb is preserved and well kept.,False,False,False,False,False,True,False,0,0
8077,red carpet,"A dark red carpet, soft, lush, thoughtfully laid out and relatively clean.",False,False,False,False,False,True,False,0,0
8083,long table,The kitchen table has been used for dining for many years.,True,False,False,False,False,True,False,0,0
8091,seats,A standard seat crafted by a carpenter. Sturdy and useful for resting.,False,False,False,False,False,True,False,0,0
8093,mug,The mug appears to have been carved by a master woodworker.  It is smooth and perfect.,False,False,False,False,True,False,True,0,0
8095,large ornate carpet,The carpet covers a large area.  The colors of the carpet are neutral and muted.,False,False,False,False,False,True,False,0,0
8107,manikins,The manikin has no head and stands without clothing.,False,False,False,False,False,True,False,0,0
8121,bookshelf,"The bookshelf stands empty, cobwebs and dust filled the corners of its shelves in place of books.",False,False,False,False,False,True,False,0,0
8125,music stands,"The music stand is made of silver, with many intricate details engraved on it.",False,False,False,False,False,True,False,0,0
8127,gentle rolling hills,The hill is slightly sloped and somewhat bumpy overall.,False,False,False,False,False,True,False,0,0
8135,grasslands around the cottage,"The grassland is lush and green, it's beautiful wild flowers extending far beyond the eye's reach.",False,False,False,False,False,True,False,0,0
8145,ornate altar,The alter is beautiful and ornate.  Whoever built it spent time making it.,False,False,False,False,False,True,False,0,0
8147,golden plate,The golden plate is covered in a thin layer of dust.,False,False,False,False,False,True,True,0,0
8151,wooden bench,"Looking at the bench, it looks newly built, and it seems like getting made from Redwood tree, which makes it durable.",False,False,False,False,False,True,False,0,0
8159,jungle floor,The floor is shiny and well cleaned now that the soldiers finished cleaning it.,False,False,False,False,False,True,False,0,0
8167,rugs,The rug is well worn having some holes in its fabric.,False,False,False,False,False,True,True,0,0
8169,iron grill,The grill is black and full of soot.  It hasn't been cleaned in ages.,False,False,False,False,False,True,False,1,0
8173,floor to ceiling shelves,The floor to ceiling shelves encompass most of the room.,False,False,False,False,False,True,False,0,0
8179,end tables,"The end table is small and unassuming, only large enough to hold perhaps a candle.",False,False,False,False,False,True,False,0,0
8183,wood floors,A floor made from timber. Glossy and well maintained.,False,False,False,False,False,True,False,0,0
8193,field,The field is in good health and will yield many more crops for years to come.,False,False,False,False,False,True,False,0,0
8199,bookcases,"You see a thick layer of dust which lines the shelves of the short bookcase, an item which is furnished with numerous ancient texts.",False,False,False,False,True,False,False,0,0
8201,platform,"The platform's wooden base is heavily stained, bearing the permanent marks of the items that have sat upon it.",False,False,False,False,False,True,False,0,0
8209,stalls,The stall is thin and cramped. Staying here is probably a nightmare for any animal.,False,False,False,False,True,False,False,0,0
8221,long wooden dining table,"The long wooden dining table is getting old, you can see the discoloring of it.",False,False,False,False,False,True,False,1,0
8223,normal benches,The bench is sturdy and made of wood.  It is a dark color.,False,False,False,False,False,True,False,0,0
8249,ruins of buildings,The ruin is crumbling and you wonder what kind of building it might have been.,False,False,False,False,True,False,False,0,0
8255,carpet,The carpet is so thick you could rest your aching body on it.,False,False,False,False,False,True,False,0,0
8259,marble furniture,The marble furniture Is used by the king and queen during royal dinners.,False,False,False,False,False,True,False,0,0
8269,large earthenware jug of water for cooking and drinking,The jug is simple earthenware with a bit of blue glaze around the rim.,False,False,False,False,True,False,True,0,0
8273,pot for cooking,The pot is hot and somehow ready for cooking.,False,False,False,False,True,False,True,1,0
8283,small pool of water,"The pool of water is small and oblong in shape. The water is murky, so it's hard to tell how deep it is.",False,False,False,False,True,False,False,0,0
8285,wood walls,"The wood walls, despite looking well worn they remained standing and strong.",False,False,False,False,False,True,False,0,0
8289,sewers,That sewer is filthy and clogged and needs some cleaning and repair.,False,False,False,False,True,False,False,0,0
8319,fishing nets,The fishing net is specially designed to catch the maximum amount of fish in front of the King's castle,False,False,False,False,True,False,True,0,0
8321,crates,The crate is made of wood and you can't see what is in it.,False,False,False,False,True,False,True,0,0
8341,chest of drawers,You hear something rattling within. All the drawers are closed tight.,False,False,False,False,True,False,False,0,0
8343,bottle of wine,The bottle of wine seems tempting.,True,False,False,False,True,False,True,0,0
8359,stained wooden troughs,The trough is deeply stained due to use and has a few holes in it.,False,False,False,False,True,False,True,0,0
8361,cash box,This old wooden cash box has a lock on it. It is rustic and has initials embroidered and carved in it.,False,False,False,False,True,False,True,0,0
8367,walls of the cave,"The wall of the cave is dark, rough and bumpy to the touch.",False,False,False,False,False,True,False,0,0
8375,booth,The wooden booth has high-backed seats and intricately carved arms. It is a comfortably place for several people to sit.,False,False,False,False,True,False,False,0,0
8377,sheer screen,The sheer screen is worn out due to age and broken in spots.,False,False,False,False,False,True,False,1,0
8391,chamberpot,"The chamberpot is extremely clean, as though it never gets used.",False,False,False,False,True,False,True,0,0
8393,couch,The couch is made from polyester and is not very comfortable.,False,False,False,False,False,True,False,0,0
8405,ivory spikes,These spikes clearly came from the tusks of a very large beast.,True,False,False,False,False,True,True,0,0
8407,large ornate table,the large ornate table is covered in dust and cob webs,False,False,False,False,False,True,False,1,0
8417,writing paper,"The writing paper's thin parchment is showing signs of wear, turning yellow on the corners.",False,False,False,False,False,True,True,0,0
8423,public bath,"The public bath is very clean, ideal for anyone trying to bathe.",False,False,False,False,True,False,False,0,0
8429,ground,"It is wet, muddy, and does not smell pleasant.",False,False,False,False,False,True,False,0,0
8449,meadow,You notice meadow shown beaute as it set about the castle.,False,False,False,False,False,True,False,0,0
8455,wooden chair,The chair is sturdy enough that even the heaviest man can sit on it.,False,False,False,False,False,True,False,0,0
8457,cozy fur rug,"The cozy fur rug is large and heavy, who ever claimed it would have put in quite the fight.",False,False,False,False,False,True,False,0,0
8461,big bed,"With its covers stripped, you see a large stain that can only be blood.",False,False,False,False,False,True,False,0,0
8463,light fireplaces,The fireplace is hot and full of fire that heats the house.,False,False,False,False,False,True,False,0,0
8467,beakers,"The glass that the beaker is made of looks warped, with small bubbles and strange whorls.",False,False,False,False,True,False,True,1,0
8471,vat,"This vat is quite large and is made of metal that has a pitted, rough surface to it.",False,False,False,False,True,False,True,0,0
8481,creepy steps,"Old and dark grey, with split treads and cracking risers, the step looks as if it would collapse into splinters under your weight.",False,False,False,False,False,True,False,0,0
8483,cottage,The tiny stone cottage displays its age with its moss coated outer walls and cobwebbed corners.,False,False,False,False,True,False,False,0,0
8485,moor,The moor is vast and filled with wild plants and animals. It has been untouched by any man.,False,False,False,False,True,False,False,0,0
8493,wood pile,A pile of firewood is neatly stacked as tall as a man in preparation for winter.,False,False,False,False,True,False,False,0,0
8501,small fire,"The small fire provides a suitable cooking arrangement or a place for warmth, it's hot glowing embers burning a bright red.",True,False,False,False,False,True,False,1,0
8507,seats made of plant roots,The seat blends in with its natural surroundings.  It looks as though it has grown from preordained design with some specific purpose in mind.,False,False,False,False,False,True,False,1,0
8511,basket of flowers,The basket is filled with wilted flowers dying flowers.,False,False,False,False,True,False,True,0,0
8523,candle holders,The holder is so old it couldn't even hold a candle anymore. It's rusted out.,False,False,False,False,True,False,True,0,0
8533,bassinets,"The bassinet is made of simple pine, and it is the perfect size for a baby.",False,False,False,False,True,False,False,0,0
8535,rocking chairs,This rocking chair is wooden and detailed ornately by an old woman. This rocking chair has a wonderful stain and is carved beautifully.,False,False,False,False,False,True,True,0,0
8537,little wooden stool,The little wooden stool is worn and battered from use.,False,False,False,False,False,True,False,0,0
8539,bookshelf,The bookshelf has the best garden magazines.,False,False,False,False,False,True,False,0,0
8547,bookcase,The bookcase is large and made of sturdy wood.,False,False,False,False,True,False,False,0,0
8561,thick glass mugs,"The mug is made of thick glass, and there are a few chips in the rim.",False,False,False,False,True,False,True,0,0
8563,thick wooden mugs,the mug is colorful and huge.,False,False,False,False,False,True,True,0,0
8575,warm blankets stacked neatly,The blanket is made of wool instead of cotton and this may cause children to itch excessively.,False,False,False,False,False,True,True,0,0
8585,doghouse,The doghouse has a slanted roof and a small door for a dog.,False,False,False,False,True,False,False,0,0
8593,sandcastles made by children,"The sandcastle was crafted from wet sand, pebbles, and twigs. It has partly washed away with the tide.",False,False,False,False,True,False,False,0,0
8597,broken vase,"The vase is a ordinary color so as to not attract attention, but an experienced soldier understands it may contain a weapon.",False,False,False,False,True,False,True,0,0
8603,adventurer's remains,Kneeling to inspect the adventure's remains you discover large claw marks on the face and chest.,False,False,False,False,True,False,False,0,0
8607,corroded vessel,"The corroded vessel was once a great instrument of travel, taking the nation's adventurers far beyond the reaches of their homeland, but it has since been abandoned and it's sides were covered in a coat of moss.",False,False,False,False,True,False,False,0,0
8609,crumbling grave stones,The gravestone is chipped and surrounded with mold from being unkept,False,False,False,False,False,True,False,0,0
8611,rotting wooden fence,The fence is sturdy and will hold up for another 30 years.,False,False,False,False,False,True,False,0,0
8615,incense burner,Billows of smoke plume from the incense burner.,False,False,False,False,False,True,False,1,0
8619,bird bath,"The bird bath is full of water, its ornate beauty attracting attention.",False,False,False,False,False,True,False,0,0
8639,water buckets,The water bucket is made of wood and sealed with metal.,False,False,False,False,True,False,True,1,0
8647,food trays,the food tray held many different types of food in its time,False,False,False,False,False,True,True,0,0
8663,coffins,The wooden coffin appears to have been hastily constructed. Many nails protrude from its surface.,False,False,False,False,False,True,False,0,0
8665,beach,"The beach stretches out, long and narrow, as its amber sands are kissed by gentle waves.",False,False,False,False,False,True,False,0,0
8667,pier,The pier is rickety and broken in spots.,False,False,False,False,False,True,False,0,0
8681,cooking pot,The cooking pot is rusted at the bottom and no longer usable,True,False,False,False,False,True,True,0,0
8713,frosted window,The frost window is a great look for the place.,False,False,False,False,False,True,False,0,0
8725,hole,"The hole appeared practically over night, it reaching far beneath the earth's surface into darkness. One would hope to never fall in.",False,False,False,False,True,False,False,0,0
8737,eisel,The eisel is made of wood and is old and dusty.,False,False,False,False,False,True,True,0,0
8747,wooden chairs,The chair appears more like a throne.,False,False,False,False,False,True,False,0,0
8755,tiles,"The tile is a mosaic pattern of flowers and lines, somethig you only find in the richest peoples homes.",False,False,False,False,False,True,False,0,0
8757,sarcophagus,"The sarcophagus is ancient and old, it has an engraving detailing the adventures of the king that now rests inside.",False,False,False,False,False,True,False,0,0
8761,back row seat,The back seat is made of fine leather and is big enough for the king to sit in,False,False,False,False,False,True,False,1,0
8773,velvet cushion,the cushion is soft and clean.,False,False,False,False,False,True,True,0,0
8775,footstool,The footstool is decorated with an intricate floral design the likes of which you have never seen.,True,False,False,False,False,True,True,0,0
8779,"long, wooden table","The table is long and wooden, stained from use with dents on its surface.",False,False,False,False,False,True,False,0,0
8783,dinner plates,"The plate looks old and dirty, but through the thick layer of dust an ancient inscription peeks through, finely woven letters that tell of a forgotten past.",False,False,False,False,False,True,True,1,0
8797,bags,The bag is large and wide with extra pouches for more items.,False,True,False,False,True,False,True,1,0
8799,grimy stools at the wooden bar,The stool is dirty and grimy.  It is made of wood with a leather seat.,False,False,False,False,False,True,True,0,0
8811,buckets full of ice,The bucket is wet and surrounded by condensation from the ice inside,False,False,False,False,True,False,True,0,0
8817,buckets of water,The bucket of water is dark and grimy. The wood holding it together has long since rotted.,True,False,False,True,True,False,True,0,0
8823,wood,Looks like the tree was struck by the lightening because the wood has a very unusual patterns,True,False,False,False,False,True,True,0,0
8841,cloth coin purse,The cloth coin purse is almost bursting with stolen golden coins.,False,False,False,False,True,False,True,0,0
8855,granite,The granite is extremely massive in size and has a black color with white glistening rocks scattered throughout.,False,False,False,False,False,True,False,0,0
8859,barstool,"The barstool is so worn out, it appears as if it will collapse if another person sits on it.",False,False,False,False,False,True,True,0,0
8867,fecal matter,The fecal matter was that of the cows of the fields.,False,False,False,False,True,False,True,0,0
8869,white overflowing regalia,Pure white can't even begin to describe the color of this long flowing regalia; highly decorated with ornate patterns and precious stones.,False,True,False,False,True,False,True,0,0
8879,patio with a wooden roof,The patio is filled with mold and smells of rotten wood,False,False,False,False,True,True,False,0,0
8903,chest plate,the plates are white in color,True,False,False,False,False,True,True,0,0
8905,candies,These candies look delicious and appear to have different fruit flavors.,False,False,True,False,True,False,True,0,0
8907,backpack,the backpack is light and faded,False,False,False,False,True,True,True,0,0
8909,sandals,the sandal had sand on it,True,False,False,False,False,True,True,0,0
8913,valuable mementos,The necklace is just one of several valuable mementos.,False,False,False,False,True,False,True,0,0
8915,ledger,"The ledger is spiral bound and has a green cover. Inside, the pages are perfect indicating someone has taken care to ensure its condition.",False,False,False,False,True,True,True,0,0
8917,cave,"The cave was dark and dank, and smelled musty inside.",False,False,False,False,True,True,False,0,0
8919,foot lockers,Items placed in the old wooden foot locker always come out smelling like the mahogany it's made of.,False,False,False,False,True,True,False,1,0
8925,brothels,The brothels are seedy here.,False,False,False,False,True,False,False,0,0
8935,small coin pouch,"The coin pouch is made out of leather, it looks old and has a brown color.",False,False,False,False,True,False,True,0,0
8941,suitcase,the suitcase was filed with clothes,False,False,False,False,True,True,True,0,0
8947,wooden slide,"The slide is slick, even though wooden, and fun to slide down.",False,False,False,False,False,True,False,0,0
8951,sacks of flour,This sack of flour looks a bit leaky.  You imagine you'll probably have white flour marks all over you if you pick this up.,False,False,False,False,True,False,True,0,0
8955,catapults,The catapults appear to be made of sturdy timber and thick logs that are suitable for supporting heavy stone weights.,True,False,False,False,False,True,False,0,0
8975,plaza,"Here is a large, empty plaza area. There is a market here every morning at dawn, and locals gather here for celebrations and important announcements.",False,False,False,False,True,False,False,0,0
8991,coinpurse,"This pouch is small, but it could hold a few coins or nice pebbles.",False,False,False,False,True,False,True,0,0
8993,water container,"Layers of limestone line the vessel, indicating the consistent transport of hard water.",False,False,False,False,True,False,True,0,0
8995,memento,The old memento is worn out and faded from time.,False,False,False,False,True,False,True,0,0
9019,documents,These documents are written in what appears to be an ancient language. One would need a translator to read them.,False,False,False,False,True,False,True,0,0
9023,brown linens,The linen is thin and mostly white but several stains of red and dark brown are splattered about it.,False,True,False,False,False,True,True,0,0
9029,crude toilets,The crude toilets reek. They are full of filth from human waste.,False,False,False,False,True,True,False,0,0
9065,common supplies,These supplies could be useful for a variety of common tasks.,False,False,False,False,True,False,True,1,0
9071,wood,this wood will be very good in making furniture,False,False,False,False,False,True,True,0,0
9101,ice,"The ice is cold and hard, but beautiful to see.",False,False,False,False,False,True,False,0,0
9111,torn pants,You notice your pants have been ripped and several places.,False,True,False,False,True,False,True,0,0
9121,saucer,The saucer is plain and white with brown stains from spilled tea.,False,False,False,False,False,True,True,2,0
9131,tiara,The tiara is golden in color and has three points that protrude above it. The tiara also has three emerald gemstones implanted in a triangle at the center.,False,True,False,False,True,False,True,0,0
9133,carriages,The carriage is rusted and broken down with the wheels noticeably missing,False,False,False,False,True,True,False,0,0
9157,wizard's robe,Perhaps this robe has traces of ancient magic woven into its threads.,False,True,False,False,True,False,False,0,0
9159,pants that have holes in them,The pants have so many holes that it looks as though they're nearly invisible.,False,True,False,False,True,False,True,0,0
9163,dart gun,The gun seems pieced together from several metal objects and other devices. It has a dark patina that would ensure its concealability.,True,False,False,False,True,False,True,0,0
9165,ant hill,The mound of dirt is full of vicious ants.,False,False,False,False,True,False,False,0,0
9171,pipe,The pipe is about two feet in length and has threads on both ends where it has been meant to screw into something else. It is made of copper and has an aged patina.,True,False,False,False,True,False,True,0,0
9175,family photo,"The photo is old and dusty. Upon closer inspection, you realize that the people in the photo are all children with blonde hair.",False,False,False,False,False,True,True,0,0
9187,table cloth,The table cloth was worn and possessed much steel cutlery.,False,False,False,False,True,True,False,0,0
9195,canons,The canon looks quite menacing with its heavy black iron construction.  You wonder if there's a cannonball and gunpowder inside it...,True,False,False,False,True,False,False,0,0
9197,large iron crest,the crest is long and big,False,False,False,False,False,True,False,0,0
9207,enclosures for animals,"The enclosures are constructed from sturdy, thick oak logs bound together with ropes.",False,False,False,False,True,False,False,0,0
9213,battle plans,The plans are clearly meant for battle.,False,False,False,False,True,False,True,0,0
9221,podium,The podium is tall enough to tower over men.,False,False,False,False,False,True,False,0,0
