id,name,description,wieldable,wearable,food,drink,container,surface,carryable,assigned,annotated
9231,bunk beds,The bed is primarily iron and has been originally made for royalty. The markings indicate there must have been a special attachment to stars and whales.,False,False,False,False,False,True,False,0,0
9235,leather pouch,You could put coins or other small objects in this pouch.,False,True,False,False,True,False,True,0,0
9241,knapsack,the knapsack is old and rugged,False,False,False,False,True,True,True,0,0
9243,old smock,The old smock is stained and torn in a few places,False,True,False,False,True,False,True,0,0
9257,black leather hood,The hood shows signs of extensive wear. It has an elastic band to ensure a tight fit.,False,True,False,False,True,False,True,0,0
9261,pathways,The pathway was long and looked very neglected.,False,False,False,False,True,True,False,0,0
9273,hygiene supplies,This hygiene supply item is in pristine condition and ready to be used,False,False,False,False,True,False,False,0,0
9275,textile,the textile is new and colorful,False,False,False,False,True,False,True,1,0
9279,dessert,"Dessert for the feast was a pastry made of honey, barley and spices.",False,False,True,False,True,False,True,0,0
9303,charcoal,Charcoal is the best to grill all kinds of meat on!,False,False,False,False,False,True,True,0,0
9311,satchels of spices,The satchels of spices smell fragrant.,False,True,False,False,True,False,True,0,0
9315,"handsome, cozy farmhouse",The farmhouse acted as shelter for lost travelers.,False,False,False,False,True,False,False,0,0
9345,stone slab,A stone slab can be used to build walls. Stone slabs can be thrown for defense of the city.,True,False,False,False,False,True,True,0,0
9355,slingshot,The slingshot looks as though it's been used in combat as there is blood on the handle.,True,False,False,False,False,True,True,0,0
9365,huge trees,The tree is tall and skinny but branches out to form a large canopy on top.,False,False,False,False,True,True,False,0,0
9367,goods,"The goods lay scattered, but still appear to be usable.",False,True,True,True,True,False,True,0,0
9369,scabbard,this scabbard has been a sheath for a couple of a blades and its still shining.,False,False,False,False,True,False,True,0,0
9383,pressed trouser,"This trouser has very deep pockets, is fully lined for comfort, and appear to be very comfortable.",False,True,False,False,True,False,True,0,0
9387,pallet,"The pallet is fashioned from long, freshly sawed wooden planks nailed together to form a solid base.",False,False,False,False,False,True,False,0,0
9391,downward slope going straight into the water,The slope muddy and filled with stones as it angled down into the water,False,False,False,False,False,True,False,0,0
9421,bits of straw,Thou straw was piled up as a mule's manure.,False,False,True,False,False,True,True,0,0
9429,oaken scaffolds,The oaken scaffold appears to be rotting in some parts.,False,False,False,False,False,True,True,0,0
9443,bazaar,"The bazaar is full of merchants selling their wares. It smells of fresh bread, exotic spices, and the faint aroma of goat dung.",False,False,False,False,True,False,False,0,0
9447,stone walk ways,"The stone walk ways are so hard that footwear is a necessity, if you want to walk on the path.",False,False,False,False,False,True,False,0,0
9463,small coin pouch,the coin pouch is on the table,False,False,False,False,True,False,True,0,0
9473,short pants,"This red pair of pants will do in a pinch, but they are a bit short, and possibly silly.",False,True,False,False,True,False,True,0,0
9479,cement pathway,The path before you is made of concrete.,False,False,False,False,False,True,False,0,0
9491,glasses,The glass is dirty and appears to not have been washed in quite a while,False,False,False,False,False,True,True,1,0
9493,cobbles,The cobble is rough to the touch and is a pale color,False,False,False,False,False,True,False,0,0
9501,farmhouse,"The farmhouse is almost green from mold, and its boards are broken and missing.",False,False,False,False,True,False,False,0,0
9505,hankercheif from a lady,The hankercheif is tattered and torn in multiple places. It is mostly green in color with white Fleur-de-leis sprinkled in a symmetrical pattern.,False,True,False,False,False,True,True,0,0
9525,tinderbox,the tinderbox looks so priceless.,False,False,False,False,True,False,True,0,0
9535,dragons,The dragon is usually a rogue species but can be tamed and rode into battle like a horse.,False,False,False,False,False,True,False,0,0
9541,lodge,The dilapidated lodge looks like it hasn't had guests in a very long time.,False,False,False,False,True,False,False,0,0
9545,old wheel barrels,"The barrel looks empty, but upon lifting you notice it has some kind of liquid in it.",False,False,False,False,True,True,False,0,0
9553,pouch,"The pouch is made of fine silk cloth, colored bright red. It has a leather string keeping it sealed.",False,False,False,False,True,False,True,0,0
9555,small stuffed animal,"This small animal appears to be a child's toy, but perhaps it is hiding a dangerous secret.",False,False,False,False,True,False,True,0,0
9571,pitcher of water,The pitcher is made of a shiny metal similar in appearance to stainless steel. It has a large pour spout and ornate handle.,True,False,False,False,True,False,True,0,0
9583,luxuries,Luxuries such as these are only available to noblemen and princes.,False,True,False,False,True,True,True,0,0
9585,small sachel,"The smallish bag is made of leather, and has probably been worn by a small creature.",False,True,False,False,True,False,True,1,0
9605,wider slots,this slot could contain a lot of things.,False,False,False,False,True,False,False,0,0
9621,large yard,I nice yard and you can tell someone takes care of it.,False,False,False,False,True,True,False,0,0
9625,large wooden outpost,"The wooden outpost is foreboding, it looms above all who observe it.",False,False,False,False,True,False,False,0,0
9631,fishing hook,"This bit of curved and sharpened metal is tiny, but viscous. Watch your fingers.",False,False,False,False,False,True,True,0,0
9643,charms,The charms sparkled in the sun and were in a variety of different colors.,False,True,False,False,True,False,True,0,0
9647,glasses,The glass looks beautiful and carefully crafted with symbol of sword and shield. It is suited for a king or a land lord.,True,False,False,False,True,True,False,0,0
9659,satchel,It is a bag made of leather. It could be used to carry items on one's person.,False,True,False,False,True,False,True,0,0
9663,fronds,"The palm fronds appear simple, but the branches and leaves are actually quite spiky and dangerous.",True,False,False,False,False,True,True,1,0
9671,broken down wood wagons,The wagon is rudimentary and not well-built. It only holds enough space for two people and a small amount of cargo.,False,False,False,False,True,True,False,1,0
9713,fishermen's belongings,The belongings were damp and covered with salt from the recent trip to the sea.,False,True,False,False,True,False,True,0,0
9733,wooden boxes,"The square, gray box is constructed of weathered pine boards attached to each other with rusty nails.",False,False,False,False,True,False,True,0,0
9747,bunks,The bunk is damp and musty-smelling.,False,False,False,False,True,True,False,0,0
9753,empty looking coin pouch,The pouch is empty.,False,True,False,False,True,False,True,0,0
9757,possessions,"The possession is wooden and has a message carved within. The message seems to be written in some ancient, Egyptian language.",False,False,False,False,False,True,True,0,0
9759,gold candle fixtures,The fixture in inlayed with gold and has a place for a candle.,True,False,False,False,True,True,False,1,0
9777,mantel,The mantel is a deep brown wood polished wood.,False,False,False,False,False,True,False,1,0
9783,wooden knight,The knight is wooden.,False,False,False,False,True,True,False,0,0
9787,jumpsuit,"Looking closely at this green wool jumpsuit, one can see detailed stitching. It appears to have been made by an expert.",False,True,False,False,True,False,True,0,0
9793,light house,"The lighthouse is made of bricks, with a large fire powered light on top. There is a huge glass in the window to magnify its light.",False,False,False,False,True,False,False,0,0
9801,wolf costume,This wolf costume is ratty and appears to have served its useful life. It also smells as if it may have been used for rodent bedding.,False,True,False,False,True,False,False,0,0
9807,big overcoat lined with pockets,Whoever owned this coat was either a trinket salesman or a pack rat.,False,True,False,False,True,False,True,0,0
9823,silver platter,"The silver platter is so clean, it can be used as a mirror.",False,False,False,False,False,True,True,0,0
9833,decanters,The decanter is full of a deep red liquid.,False,False,False,False,True,False,True,0,0
9837,backpack,The backpack is salty in terms of condition with a few tears and field repairs,False,True,False,False,True,True,True,0,0
9851,mortar,"this mortar is so magnanimous from the look of it,so beautiful.",False,False,False,False,False,True,False,0,0
9855,easel,"This easel is made out of wood, its old and with a few holes in it.",False,False,False,False,False,True,False,0,0
9861,endless mounds,"This mound of dirt looks like it might be a shallow grave.  You probably wouldn't want to stand on top of it, just to be safe.",False,False,False,False,False,True,False,1,0
9869,cloak,"The dark cloak was black as night, and offered protection against the elements.",False,True,False,False,False,True,True,0,0
9887,toilets,The toilets were dank and smelly from months of accumulated waste.,False,False,False,False,False,True,False,0,0
9893,cages,The cage is made for an animal of medium size such as a coyote or fox. The metal looks used but seems to have been cared for.,True,False,False,False,True,False,True,0,0
9895,lures,The lure is a metal object used in the sport of fishing. It is a metal hook or a similar metal object used to attract the fish to be caught.,True,False,False,False,True,True,True,0,0
9897,large overstuffed settee,what a beautiful sofa to leagues can be noticed that it is of very good quality,False,True,False,False,True,True,False,0,0
9901,rat's nests,The rat's nests are a tangled ball of found objects.,False,False,False,False,True,True,True,0,0
9909,fine goods,The peasant had saved up enough money to buy some fine goods in the market.,False,False,False,False,True,False,True,0,0
9911,coin pouch,This gold pouch jingles when you walk.,False,True,False,False,True,False,True,0,0
9919,cradle,The cradle looks brand new.,False,False,False,False,False,True,False,0,0
9975,dark garments,Here are several garments in dark tones. Someone wearing these items would easily be able to shroud themselves in dark woods or hidden nooks.,False,True,False,False,True,False,True,0,0
9981,broken down wooden wagons,These broken wagons are rotting from being left in the rain and mud. There could be parts here that are useful.,True,False,False,False,True,True,True,0,0
9985,leather lunch pouch,the pouch is colorful and beautiful.,True,False,False,False,True,True,True,0,0
9989,saddle,the saddle is old and worn out,False,False,False,False,False,True,False,0,0
9995,money pouch,It's made of fabric. It has a closure.,False,False,False,False,True,True,True,1,0
10003,large animal hide,this hide is so good for animas,False,False,False,False,True,False,False,0,0
10015,scattered glass,The glass is broken in large shards. It is quite thick measuring around one inch in overall thickness.,True,False,False,False,False,True,True,0,0
10033,potion supplies,The potion supplies are viscous and green.,False,False,False,True,True,False,False,0,0
10041,hollowed out tree,"The tree looked normal from most vantage points but when you got up close you could tell it was hollowed out, there was a small openening that was hidden from the naked eye where you could place things inside.",False,False,False,False,True,False,False,1,0
10043,jug of water,"The jug appeared ancient. Cracked and moldy, but held refreshing water.",False,False,False,True,True,False,True,1,0
10053,empty bag,The bag is made of fine leather and embedded with diamonds,False,False,False,False,True,True,True,1,0
10055,observatory,The observatory is large and white-colored.,False,False,False,False,True,False,False,0,0
10057,trees,The trees are old oaks with sprawling branches evenly spaced for climbing or hiding out in.,False,False,False,False,True,True,False,0,0
10067,rocking chair,"The rocking chair was old and worn out having been used a great deal, but it still looked very comftorable.",False,False,False,False,False,True,False,0,0
10085,gifts,"Wrapped in colorful paper and ribbons, the gift must hold an exciting mystery inside.",False,False,False,False,True,False,False,1,0
10089,hole,The hole appears to be very deep and may lead to some treasure,False,False,False,False,False,True,False,0,0
10099,animal skins,The animal skins were finely tanned and she wore them with pride.,True,True,False,False,False,True,True,0,0
10103,inkpot,The inkpot is jet black with a large central spherical chamber.,False,False,False,False,True,False,True,1,0
10105,leather boots,The leather boots helps to prevent a harmful inscet,False,True,False,False,True,False,False,0,0
10111,thick blue ice,On the winter season thick blue ice formed over lake,False,False,False,True,True,False,False,1,0
10115,glade,"The glad appeared through the forest trees, vast and green.",False,False,False,False,True,False,False,0,0
10119,floor,That was seeping through from floor to floor,False,False,False,False,True,False,True,0,0
10123,fist,The fist is large with scars and cuts on it.,True,False,False,False,True,False,False,0,0
10125,bouzoukis,His bouzoukis is finely tuned and plays beautifully when he strums it. The ornate pattern sprawled up the neck and is wonderfully unique.,True,False,False,False,False,True,True,0,0
10135,gps,is a satellite navigation system used to determine the ground position of an object.,False,False,False,False,False,True,True,0,0
10143,barrel of rocks,The old oak barrel is covered in dust and looks like it hasn't been touched in decades.,False,False,False,False,True,True,True,0,0
10147,arena,You've never seen a building as large as this one! Surely there's enough room in this arena for an entire village's worth of people.,False,False,False,False,True,False,False,0,0
10155,lab coat,The white lab coat's polished buttons gleam with a sterile sheen.,False,True,False,False,True,False,True,0,0
10163,toad,"The toad is a warty little creature and his appearance is very average, except for the eyes.  The eyes seem to hold the soul of a much wiser creature.",False,False,True,False,True,False,True,0,0
10169,concrete,"substance used for building which is made by mixing together cement, sand, small stones, and water. The posts have to be set in concrete.",False,False,False,False,False,True,False,0,0
10173,black rock,"Upon further examinations this is no ordinary rock, but a black rock with a foreign inscription that appears to glow in the firelight.",True,False,False,False,False,True,True,0,0
10179,knife sheaths on a belt,"This was a large leather sheath, it looked to be heavily used with patches here and there on the sewing, it could hold a large sword.",False,False,False,False,True,False,True,0,0
10193,uncomfortable bed,"A closer inspection of the bed, it was littered with dirt and webs. You couldn't even sleep on it, the bed, hard as a rock and old.",False,False,False,False,False,True,False,0,0
10195,shoes,Hopefully there aren't any eight legged critters living in this pair of leather shoes. It might be a good idea to check inside before you put them on.,False,True,False,False,True,False,True,0,0
10205,stool,The stool is wooden and small. Its oak structure is durable and sturdy.,False,False,False,False,False,True,False,0,0
10207,business,"You know that the owners here will give you a fair deal, and treat you not just as a customer - but as an equal.",False,False,False,False,True,False,False,0,0
10209,alms bowl,"The bowl used for alms is decrepit and gray, battered and worn.",False,False,False,False,True,False,True,0,0
10211,cotton bonnet with ruffles and ties,It's a bonnet the likes of which would compliment an old witch.,False,True,False,False,False,True,True,0,0
10219,ground,You notice the ground has absorbed a lot of fairy blood.,False,False,False,False,False,True,False,0,0
10231,goblet,The golden goblet is decorated with emeralds.,False,False,False,False,True,True,True,1,0
10235,stalls,He grabbed his horse from it's stall and proceeded to ride into the battle to reclaim his honor.,False,False,False,False,True,False,False,0,0
10239,velvet pouch,The runes clatter against each other gently inside the velvet pouch that is carrying them.,False,False,False,False,True,True,True,0,0
10251,garden tools,"this equipments  helps the garden to maintain, each euipment has each purposes it is very easy to carry and handle. It is also very easy to maintain the equipment rusting.",True,False,False,False,True,False,True,0,0
10255,scythe scabbard,The scabbard is large and decorated with rare gems,False,False,False,False,False,True,False,0,0
10261,ornate tapestries,"a heavy handwoven reversible textile used for hangings, curtains, and upholstery and characterized by complicated pictorial designs.",False,False,False,False,False,True,True,0,0
10277,pit of quicksand,The resulting sand is a mushy mixture of sand and water that can no longer support any weight.,False,False,False,False,True,False,False,0,0
10279,satchel of dried meat,"The satchel smelled of seasoned meat, the inside of it had a greasy look to it, it had a long rope to loop it around your neck.",False,False,True,False,True,False,True,0,0
10281,ankle boots,It's a disgusting sight as you realize there is still a goblin foot in the boot.,False,True,False,False,False,True,True,1,0
10287,cot,"Women who smoke during pregnancy increase their risk of miscarriage, premature delivery and cot death",False,False,False,False,True,True,False,0,0
10293,portal for evil to access,The portal somehow seems to emit a dark form of light; only horrible things could be inside.,False,False,False,False,True,False,False,0,0
10295,book,And chosen people is the tittle of the book within the book,False,False,False,False,True,False,True,0,0
10301,tusks,The tusks are made of pure ivory and there appears to be a mysterious marking in an unknown language printed on the sides.,True,False,False,False,True,False,True,0,0
10303,manacles,On the alleged torture and abusive treatment is manacles,True,False,False,False,True,False,True,0,0
10305,old fire pit,This fire pit looks ancient. It could have been used for cooking or forging weapons.,False,False,False,False,False,True,False,0,0
10309,piece of bread,"This bread is old, stale, and inedible. there seems to be mold growing from it.",False,False,True,False,False,True,True,0,0
10317,glass vial of some liquid,The vial is filled with a mysterious red liquid that reeks of ammonia.,True,False,False,False,True,False,True,1,0
10319,stairs,The stair was decayed beyond use.,False,False,False,False,False,True,False,1,0
10325,small ball of light,"glowing with such intensity, it is difficult to stare directly at the ball of light. Magic is required to wield this item.",True,False,False,False,True,False,True,0,0
10347,bench,"The bench was simple but classy, strait sturdy peices of wood that looked like they would never budge, it included a small carving by the maker on the leg.",False,False,False,False,False,True,False,1,0
10357,sack cloth,The sack cloth is made from strong bamboo and can hold the heaviest of things,False,True,False,False,False,True,False,0,0
10361,pedestal,"The wooden pedestal, although large, is very poorly made with what seems to be unfinished elm wood.",False,False,False,False,True,True,True,0,0
10377,mug,The frothy beer is overflowing in the mug.,False,False,False,False,True,False,True,0,0
10381,royal crest,"This crest is metal, and contains many panels of color, and represents a family.",False,False,False,False,True,False,False,0,0
10391,bag of shells,"The bag is full of several small objects which make a strange sound upon colliding, almost like pieces of old ceramic.",False,False,False,False,True,False,True,0,0
10405,stage,The stage is dark and battered from years of foot traffic.,False,False,False,False,True,True,False,0,0
10407,worn shoes,The soles on this pair of worn shoes are nearly see through. They've certainly covered some miles in their time.,False,True,False,False,True,False,True,0,0
10409,tin for collecting money,The tin is stained and dented. A heavily faded painted cross decorates the outer surface.,False,False,False,False,True,True,True,0,0
10411,mysterious tent,This mysterious tent has a peculiarly soft glow surrounding it.,False,False,False,False,True,False,False,0,0
10423,coin purse,"The coin purse appears to be made of a deep, rich blue velvet and it's clasp made of sterling silver.",False,False,False,False,True,False,True,0,0
10429,weapon racks,"The rack is made of hard steel, enough to hold the heaviest of weapons",False,False,False,False,True,True,False,0,0
10447,money bag,A small leather purse with a string to pull it taut.,False,False,False,False,True,False,True,0,0
10459,cages,The cage is large and shiny with a silver appearance.,False,False,False,False,True,False,True,0,0
10461,shelves,The shelf is made of beautifully stained oak and looks very well maintained.,False,False,False,False,True,True,False,0,0
10465,supply bag,"Deep and durable, this supply bag could carry plenteous amounts of items.",False,False,False,False,True,False,False,1,0
10477,money pouch,"You can imagine the jingle of coins as you turn the leather pouch over in your hands. The maker has stamped their brand onto the bottom, which you appreciate.",False,False,False,False,True,False,True,0,0
10481,shack,"In the middle of this deserted forest a shack sits, with a mossy roof and stained glass windows.",False,False,False,False,True,False,False,0,0
10489,jail cells,"The cells are bare with rusty bars on the doors, a bucket for excrement and a pile of hay in the corner for sleeping.",False,False,False,False,True,True,False,0,0
10493,piles of bones,The archaeological department find a piles of bones in historical site,False,False,False,False,True,False,False,0,0
10495,window,"The window is transparent and clean, allowing for clear vision from the inside and the outside.",False,False,False,False,False,True,False,0,0
10505,sack,"The sack is weathered and worn, showing signs of many years of use.",False,True,False,False,True,False,True,0,0
10511,etchings on the walls,Around the momentum in etchings on the walls is look beatiful,False,False,False,False,True,False,True,1,0
10513,recesses,The recesses are dark and a trickle of unseen water can be heard along with a fluttering bat.,False,False,False,False,True,False,False,0,0
10517,old wooden table,The table is creaky due to its age.,False,False,False,False,False,True,False,0,0
10521,markets,Every monday the market will opem,False,False,False,False,True,True,True,0,0
10525,sink,The sink looks like it hasn't run water in ages.,False,False,False,False,False,True,False,1,0
10533,"dull brown, boxy looking building",The building is large and square with shades of lowly lit brown,False,False,False,False,True,False,False,0,0
10537,tattered tents (abandoned looking),"a torn piece hanging loose from the main part, as of a garment or flag. a separate torn piece; shred. tatters, torn or ragged clothing: dressed in rags and tatters.",False,False,False,False,False,True,False,0,0
10541,holy robes,"the robe is old, it has a few holes on the side",False,True,False,False,True,False,True,0,0
10543,table,The table was long wooden planks with scratches and nicks in the surface.,False,False,False,False,False,True,False,1,0
10545,room,"It may not be much, but it's shelter! You can't ask for much more than four walls and a roof over your head.",False,False,False,False,True,False,False,0,0
10567,"tables, lined with maps and instruments","A mahogany table, with ornately carved legs. You can't make out the carving on the top, seeing as it's currently covered in maps and navigational tools.",False,False,False,False,False,True,False,0,0
10577,lab,The lab smells terrible and contains noxious gases.,False,False,False,False,True,False,False,0,0
10581,gravel,"The gravel is dry and dusty, having bore the footsteps of many travelers.",False,False,False,False,False,True,False,0,0
10609,cauldron,This cauldron smells horrid. You dare not see what's inside.,False,False,False,False,True,True,True,0,0
10611,rot,The rot is putrid and puss is oozing from it at a disturbing pace.,False,False,False,False,False,True,False,0,0
10631,gold,The gold medal is highest reward,False,False,False,False,True,False,True,0,0
10641,leather satchel,The brown leather satchel is bulging with coins and gems.,False,False,False,False,True,False,True,0,0
10645,belt with pouch,The belt with pouch was tightened around the knight's waist as he prepared for battle.,False,True,False,False,True,False,True,0,0
10651,fire pit,"The pit is lined with a circle of stones, full of ashes, and a small fire that struggles to stay lit.",False,False,False,False,True,True,False,0,0
10653,tray,It's a silver tray so well polished you can see yourself in it. It looks big enough to carry a hearty meal plus sides.,False,False,False,False,False,True,True,1,0
10671,throne,"The throne is opulent, and richly upholstered.",False,False,False,False,False,True,False,1,0
10673,nothing,There is emptiness.,False,False,False,False,False,True,False,0,0
10683,tent,"A flexible piece of cloth with several sticks, this tent is clearly not meant for royalty.",False,False,False,False,True,False,True,0,0
10691,small guns,The gun is tattered and dull gray with rust.,True,False,False,False,True,False,True,0,0
