id,name,description,wieldable,wearable,food,drink,container,surface,carryable,assigned,annotated
5013,pine needles,the needle is sharp and picky.,True,False,False,False,False,False,True,0,0
5041,stones,Rocks or pebbles that are common most places. Could be used as ammunition for a sling or other such devices.,True,False,False,False,False,False,True,0,0
5057,holy book,The holy book has old worn pages.,True,False,False,False,False,False,True,0,0
5079,rope,"Coiled neatly, the old rope is now worn and beginning to fray at it's end throughout it's coil.",True,False,False,False,False,False,True,1,0
5097,swords,"The sword seems to be unused, the shiny silver of the blade gleams where the light touches it.",True,False,False,False,False,False,True,0,0
5113,rocks,You see the small rock has many sharp edges.,True,False,False,False,False,False,True,0,0
5121,legendary swords made from the greatest sword makers,The sword maker creates legendary swords for battle. They are large and as sharp as humanly possible.,True,False,False,False,False,False,True,0,0
5123,ancient magical crystal that was found in the heart of a mystical dragon,The crystal is so stunning with its many brilliant crevices.,True,False,False,False,False,False,True,0,0
5161,food,The rye bread appears very dry.,True,False,False,False,False,False,True,0,0
5197,fan,The fan is made of thin pieces of wood with paper between them.  It is decorated with a pattern of flowers that have been painted on.,True,False,False,False,False,False,True,0,0
5219,dried blood,the dried blood is still contaminated,True,False,False,False,False,False,False,0,0
5235,books,The book has a simple leather binding and is rather thin.,True,False,False,False,False,False,True,0,0
5251,"vials,",The vial is partly filled with a liquid substance. You wonder what manner of strange concoctions it's contained throughout the years.,True,False,False,True,True,False,True,0,0
5265,crystal ball,The crystal ball glistens and shines and hold secrets about the future.,True,False,False,False,False,False,True,0,0
5269,metal bucket,The bucket is rusted and old.,True,False,False,False,True,False,True,0,0
5271,metal meal tray,The tray is made of metal and is cool to the touch.  There are sections to put food on the tray.,True,False,False,False,False,True,True,1,0
5275,arrows,"The arrow is bent from use, the tip dull and rusted.",True,False,False,False,False,False,True,0,0
5277,bow,"The bow is old and used, made of wood and some type of string.",True,False,False,False,False,False,True,0,0
5285,red brick,The brick has crumbled and looked very weathered.,True,False,False,False,False,False,True,0,0
5293,king's sword,"The king's sword is magnificent and ornate, with impressive metalwork around the hilt.",True,False,False,False,False,False,True,1,0
5317,torture instruments,The torture instruments thick with rust no longer able to harm,True,False,False,False,False,False,True,1,0
5345,furniture,this piece of furniture is one of a kind.,True,False,False,False,False,True,True,0,0
5347,bows and arrows,The bow and arrow set is extremely well constructed and ready for a moment's use.,True,False,False,False,False,False,True,0,0
5349,guns,"Full of old gunpowder and bullets, but the gun seems to rarely have been used.",True,False,False,False,False,False,True,0,0
5351,knives,A set of sharp steel knives. They are fairly plain but well made.,True,False,False,False,False,False,True,1,0
5353,shields,"The shield appears to be marked from battle, but still usable.",True,False,False,False,False,False,True,0,0
5365,stone,The stone is circular and worn but is not large. It can be hoisted easily.,True,False,False,False,False,False,True,0,0
5369,few rusted pieces of block,"The block seems to have had a letter engraved on it, though now you can barley make out what it is under all the rust.",True,False,False,False,False,True,True,0,0
5371,abandoned axes,The rusty old axes had dull blades. Rust and time have worn away their sharpness.,True,False,False,False,False,False,True,0,0
5425,hand carved stone,The hand-carved stone contains markings in a language that you do not understand.,True,False,False,False,False,False,True,0,0
5427,garden bench,Then bench is long enough for everyone to sit on.,True,False,False,False,False,True,False,0,0
5451,hair brush,The queen's ivory hair brush has horse hair bristles. It's pearly white handle is hand-carved and accented with jewels.,True,False,False,False,False,False,True,0,0
5465,rake,This rake is made of carefully split wood with a sturdy looking handle. Seems useful for keeping the leaves under control.,True,False,False,False,False,False,True,0,0
5467,trowel,used for digging small amount of materials,True,False,False,False,False,False,True,0,0
5469,bucket,The rusty bucket has a few dents.  The handle is broken.,True,False,False,False,False,False,True,0,0
5475,ancient books,The ancient book is written in an unknown tongue. Its strange symbols seem more like art than words.,True,False,False,False,False,False,True,0,0
5487,wooden chair,The chair was tattered and worn after many years of use in the old theater.,True,False,False,False,False,True,False,0,0
5491,spoon,"The spoon is rustic looking, as though it was carved hastily.",True,False,False,False,False,False,True,0,0
5501,fishing nets,"In its tangled mess, you see a shining object.",True,False,False,False,True,False,True,0,0
5519,wooden crucifix decorations,The power of the crucifix becomes known to enemies of those who would oppose its possessor.,True,False,False,False,False,False,True,0,0
5551,fishing rod,What an odd fishing rod. why is it so short and slimy? maybe it's very old,True,False,False,False,False,False,True,0,0
5555,bar,The bar is notched and gnarled with rust with patches of dark iron still peeking through the red.,True,False,False,False,False,False,True,0,0
5557,cup,"The cup is old and broken, with the handle chipped from being dropped",True,False,False,False,False,True,True,1,0
5561,pole,the pole is old and run down. there are still brackets that used to hold relevant signs years ago.,True,False,False,False,False,True,True,0,0
5577,serving platters,"The serving platter is clearly very old, but it has been polished recently and it gleams in the light.  Someone has taken very good care of this platter over the years.",True,False,False,False,False,True,True,0,0
5611,brown feces,The smell of the brown feces is undescribable. Its stench clings to everything it touched.,True,False,False,False,False,False,True,0,0
5627,trays,A heavy wooden tray is covered in scratches and stains from long use. It has handles on the side for carrying.,True,False,False,False,False,True,True,0,0
5639,slime,A green mass of gelatinous sludge. Filthy and to be avoided. It's difficult to clean off anything.,True,False,False,False,False,False,True,1,0
5653,broken cutlass,"This cutlass looks as though it has seen better days.  The jagged edge of its broken blade is still sharp, though.",True,False,False,False,False,False,True,0,0
5663,stool,The stool is sitting alone asking for someone to sit on it,True,False,False,False,False,True,True,0,0
5679,utensils,All of the silver utensils are polished to perfection by the kitchen staff.,True,False,False,False,False,True,True,0,0
5689,sword,"Sword's blade was sharp and sturdy. Holding it, you could tell it is well versed in the art of war, and is no stranger to the taste of blood, bone and steel.",True,False,False,False,False,False,True,0,0
5697,knife,A knife with a leather grip is now dull from use.,True,False,False,False,False,False,True,0,0
5699,whip,"The whip is black and long, the ends stained with some red substance.",True,False,False,False,False,False,True,0,0
5709,wooden logs,"The wooden log had been cut to size, its bark is already peeling.",True,False,False,False,False,False,True,0,0
5719,guns,"The metal of the gun gleams dully, exuding an air of danger.",True,False,False,False,False,False,True,0,0
5737,quill,"The quill is old and worn, it looks like it fell long ago and has lost its color.",True,False,False,False,False,False,True,0,0
5739,swords,"This sword looks to be quite sharp, and, while it doesn't look very flashy, seems to be well balanced.  There is a faint scent of oil from it to keep it from rusting.",True,False,False,False,False,False,True,0,0
5741,longbow,Many a great knight with high aspirations has been felled by the swift arrow from a humble longbow.,True,False,False,False,False,False,True,0,0
5743,horse bows,The bow looks worn from a lot of use.,True,False,False,False,False,False,True,0,0
5745,crossbows,There are several notches on the crossbow to mark how strong it can be.,True,False,False,False,False,False,True,0,0
5747,shields,The shield is heavy and large.  It has the crest of the king on it.,True,False,False,False,False,False,True,0,0
5765,serving dishes,"The dish is made of a fine porcelain, patterned with roses and swords.   A gold inlay around the rim adds a touch of majesty to an otherwise commonplace item.",True,False,False,False,False,True,True,0,0
5775,sticks,stick can be used to chase away animals,True,False,False,False,False,False,True,0,0
5781,bow,The bow is stained dark and the string feels supple to pull.,True,False,False,False,False,False,True,0,0
5787,wooden cranes,The wooden crane is cracked and rusty from lifting the king's heavy furniture,True,False,False,False,False,True,False,0,0
5807,training apparatus,On further inspection of the training apparatus you notice it was worn and had numerous sword strikes etched into it.,True,False,False,False,False,False,False,0,0
5815,practice swords,"This sword is made of metal, but upon closer inspection you can see the blade is quite dull.  It might cause some bruising if swung hard enough, but it wouldn't cut through the softest of cheese.",True,False,False,False,False,False,True,0,0
5823,moldy bread,The bread is moldy and is littered with green and black spots.,True,False,True,False,False,False,True,0,0
5829,self-portraits,"The self-portraits are huge, adorning the walls to each side.",True,False,False,False,False,False,False,0,0
5849,tattered map,"although one might notice it's an old map, you can tell what time period it's from. although the writing is smudged, you can make out letters.",True,False,False,False,False,False,True,0,0
5851,stalactites that hang from the ceiling,These stalactites are grimey and sharp. They can be used as a weapon.,True,False,False,False,False,False,True,1,0
5877,pile of books.,The book is old and has a leather cover.  There is a title on the front.,True,False,False,False,False,False,True,0,0
5895,hunting rifle,"The rifle is long, its stock barrel and grip has nicks on it from use.",True,False,False,False,False,False,True,0,0
5897,bow and arrows,A bow an arrow. Made from fine materials. Mostly used for hunting and protection.,True,False,False,False,False,False,True,0,0
5901,spikes,"The spike is rusty, but you that it is sharp enough to kill.",True,False,False,False,False,False,True,0,0
5951,wooden bowls,"A small, wooden bowl catches your eye.  Though appearing plain at first, it is imprinted with a symbol that looks incredibly familiar.",True,False,False,False,True,False,True,0,0
6009,old and almost forgotten harp,The harp is gold. The strings are long and produce beautiful music.,True,False,False,False,False,False,True,0,0
6033,children,"the chilren traveled it packs, although you weren't sure where they were going.",True,False,False,False,False,False,True,1,0
6045,weight lifting machine,The machine seems to be used often,True,False,False,False,False,False,False,0,0
6061,large wooden planks,"The large wooden plank was hand carved, it's edges straightened with obscene precision.",True,False,False,False,False,False,True,0,0
6101,ritual dagger,The ritual dagger has beautiful gems and engravings on the hilt.,True,False,False,False,False,False,True,0,0
6107,fire,The fire danced in the pit as if it possessed a spirit of its own. The flames flickered as if teasing the darkness to come closer.,True,False,False,False,False,False,True,0,0
6119,book,"The old book is bound in leather and the title is presented in gold leaf. Inside, a red velvet-y ink makes the words shine on the old paper.",True,False,False,False,False,False,True,0,0
6179,broken pottery,The broken pottery's artwork is unrecognizable. What was once a piece of art is now just shards of colorful figures.,True,False,False,False,True,False,True,0,0
6209,crucifix fixture,The crucifix has jewels embedded and a rosary attached.,True,False,False,False,False,False,True,0,0
6217,bones,The bone is gnarled and cracked at its most vulnerable points.,True,False,False,False,False,False,True,0,0
6227,bundles of arrows,The arrow is sharpebed in the way that could pierce the any thing.,True,False,False,False,False,False,True,0,0
6261,forest-scented wood,The forest-scented wood smelled strongly of pine and sap.,True,False,False,False,False,False,True,0,0
6263,stall,"It is tall and rather dusty, like nobody has sat on it for a while.",True,False,False,False,False,True,False,0,0
6265,hooks,The hook is heavy and rusty. The hook is dull and has lost it's sharpness.,True,False,False,False,False,False,True,1,0
6283,key,"The key is a large black skeleton key, seemingly made of wrought iron.",True,False,False,False,False,False,True,0,0
6287,spear,The spear has not lost its sharpness even though it is covered in a layer of dust. The stained tip a monument to victorious moments of the past.,True,False,False,False,False,False,True,0,0
6289,crossbow,"This crossbow looks well used, and has been freshly strung.  It would make a deadly weapon.",True,False,False,False,False,False,True,0,0
6293,pick,"The pick is caked with dirt and dust, as though it has been roughly used.",True,False,False,False,False,False,True,0,0
6295,axe,The axe glistens with the blood of its enemies dried on the blade.,True,False,False,False,False,False,True,0,0
6315,large and well stocked wine rack,The rack is being used to store an extensive collection.,True,False,False,True,False,True,False,0,0
6353,pike,"The pike's handle is scratched from years of battles, there is a stain of blood on it's tip.",True,False,False,False,False,False,True,0,0
6365,specks of dust,The specks of dust are thick and layered on one another.,True,False,False,False,False,False,True,0,0
6373,shiny things,"The thing is plentiful in the room, leaving a person wondering what the value is.",True,False,False,False,False,False,False,1,0
6387,pirate swords,"A sword such a this you know to be used by pirates. It is gilded in gold and jewels, and you're wary about its owner looking to retrieve it.",True,False,False,False,False,False,True,0,0
6399,pitchfork,"This pitchfork has sharp metal tines for lifting up hay, and an oak wooden handle.  It looks like it's been well used, as the handle is smoothly polished where one holds it.",True,False,False,False,False,False,True,0,0
6411,benches made from wood,The beautifully carved bench was a gift from the queen to the king upon the celebration of their wedding.,True,False,False,False,False,False,True,1,0
6433,oars,"This oar can be used to make way across a river, or it can be used to hit someone on the side of the head in a fight. Based off the moss you think it is normally used for rivers.",True,False,False,False,False,False,True,0,0
6439,wheelbarrow,The wheelbarrow is nearly broken and you wonder if it will soon fall apart.,True,False,False,False,False,False,True,0,0
6449,iron,The iron is hot so don't touch it.,True,False,False,False,False,False,True,0,0
6455,hammer,"The old hammer has a leather handle, and it's hilt is adorned with a steel ball. The hammer end is made of cast iron, and is beginning to wear out from use.",True,False,False,False,False,False,True,0,0
6463,shovel,The shovel is made of metal and silver. It is quite sturdy and appears new.,True,False,False,False,False,False,True,0,0
6471,bibles,Put enough weight behind it and that bible makes a decent impromptu weapon,True,False,False,False,False,False,True,0,0
6505,large wooden table,The table is grand with its legs at least 20 feet apart.,True,False,False,False,False,False,False,0,0
6515,guards weapons,The weapon looks menacing and sharp.,True,False,False,False,False,False,True,0,0
6519,wooden table,"The wooden table is small, but it is well made.",True,False,False,False,False,False,False,0,0
6525,torture implement,"The torture implement is rusty and looks as though it has not been used for many years.  Its point still looks sharp, and you think it probably still could be used.",True,False,False,False,False,False,False,0,0
6583,chains,"You see the chain is cut in half, one link broken down the middle with complete precision.",True,False,False,False,False,False,True,0,0
6593,knives,"The knife has a rusty blade, but its hilt appears to be made of gold.",True,False,False,False,False,False,True,0,0
6597,needles,The needle is long and thin and you wonder exactly what its use might be.,True,False,False,False,False,False,True,0,0
6635,oars,The oars are made of fine oak wood and wet from being used to steer a boat,True,False,False,False,False,False,True,0,0
6643,lamp,"The lamp, which had once been blue, has faded away mostly.",True,False,False,False,False,False,True,0,0
6663,lamp,The lamp appears to be from the east. It is adorned with an unusual design unfamiliar to you.,True,False,False,False,False,False,True,0,0
6675,homestead equipment,The homestead equipment is ready to be used.,True,False,False,False,False,False,True,0,0
6709,pots,"The dusty, clay pot is artistically crafted into the form of a slender woman, seductive and enchanting to behold.",True,False,False,False,True,False,True,0,0
6721,pen,This pen is very old and has ink stains on the side.,True,False,False,False,False,False,True,0,0
6735,ritual knife,A knife used in rituals by people. Very decorative and intricate.,True,False,False,False,False,False,True,0,0
6739,pikes,A metal weapon sharpened to a point on the end of a long pole.,True,False,False,False,False,False,True,0,0
6741,spear,The warriors carry similar long spears with a diamond tipped point for battle.,True,False,False,False,False,False,True,0,0
6745,mace,The mace is sturdy and strong. You would hate to be hit by the metal spikes that line its head.,True,False,False,False,False,False,True,0,0
6747,flail,"The flail is solid and heavy, its weight an indicator of the damage it is capable of.",True,False,False,False,False,False,True,1,0
6783,decorative swords,The decorative sword has gemstones in the handle and isn't particularly sharp.,True,False,False,False,False,False,True,0,0
6785,decorative shields,"The shield had many dents and scratches, the sides were lined with blood.",True,False,False,False,False,False,True,0,0
6787,large table with an ordinate cushion for the king's crown,"The crown is made of solid gold, adorned with the finest gems you have ever laid your eyes on.",True,False,False,False,False,False,True,0,0
6819,gift,"Wrapped in a magnificent red bow, the purple wrapping on this gift fits smoothly over the box contained inside.",True,False,False,False,False,False,True,0,0
6827,poisonous snakes,The poisonous snake has hideous fangs and eyes which are menacing red.,True,False,False,False,False,False,False,0,0
6845,detailed paintings,"The detailed paintings were peeled back, revealing maps.",True,False,False,False,False,False,True,0,0
6851,bible,"The bible is bound by black leather, its pages yellowed by years of use.",True,False,False,False,False,False,True,0,0
6907,gold silverware,On further inspection of the gold silverware you notice that it has the King's initials engraved on each piece.,True,False,False,False,False,False,True,0,0
6917,hoe for digging,Looks like nobody ever used this hoe for digging. It looks brand new and has no stains,True,False,False,False,False,False,True,0,0
6931,crossbow with no string,The crossbow is made of wood and broken from being used in combat too much,True,False,False,False,False,False,True,0,0
6955,ornate chairs,With hand-carved lion faces and coat of arms and a frame made of solid mahogany the ornate chair is fit for royalty.,True,False,False,False,False,True,False,0,0
6967,legendary swords,"The sword is very old, you would assume it had once belonged to a legendary warrior.",True,False,False,False,False,False,True,0,0
6979,money,"The small, tarnished coin is imprinted with a seal you don't recognize.",True,False,False,False,False,False,True,0,0
7021,torch,The torch is stained brown from all the times it was lit.,True,False,False,False,False,False,True,0,0
7027,rake,The rake is well worn and missing some of its long grabbing teeth.,True,False,False,False,False,False,True,0,0
7085,rusty bars,"Look at those rusty bars, doesn't look like anyone has been using them for a while.",True,False,False,False,False,False,False,0,0
7093,prayer book,The book contains many prayers. It has many pages and filled with many words on each.,True,False,False,False,False,False,True,0,0
7101,tree branches,"The tree branch is wet and rotting. It's so thick, you can barely wrap your hand around it.",True,False,False,False,False,False,True,0,0
7111,quill,The quill is long and black and writes smoothly. It is smooth to touch and the feather is soft.,True,False,False,False,False,False,True,0,0
7123,farming equipment,The farming equipment is rusted and ragged. The wooden handles are practically nothing but splinters.,True,False,False,False,False,False,True,0,0
7145,brushes,"Upon close inspection, the brush is dainty and carved with roses.",True,False,False,False,False,False,True,0,0
7159,machines,"The machine of war is devestating. Large stones sit inside it, waiting to be launched.",True,False,False,False,False,True,False,0,0
7161,weapons,"The weapon looks light and delicate, as though it couldn't really hurt anyone.",True,False,False,False,False,False,True,0,0
7175,pans,"The pan is rusty, not having been ished in sometime",True,False,False,False,True,False,True,0,0
7179,medicine,"The is so much medicine, you can barely pick which one you need. Perhaps you don't need any of it....",True,False,True,True,False,False,True,0,0
7181,cell phone,A curious dull colored object that seems to come to life and glow at random times.,True,False,False,False,False,False,True,0,0
7187,giant club,On further inspection of the giant club you notice it was stained with blood from the battle at the castle earlier.,True,False,False,False,False,False,True,2,0
7195,shovels,The shovel has a wooden handle and a metal bottom. The handle has some blood stained on it and the metal is weather beaten.,True,False,False,False,False,False,True,1,0
7211,crow bar,"The crow bar is shiny and beutiful, it is made out of a weird metal alloy.",True,False,False,False,False,False,True,0,0
7215,small metal bucket,"The metal bucket appears to be made of copper, with multiple dents and scratches on the the surface.",True,False,False,False,True,False,True,0,0
7217,bars,"The bars of gold have a wonderful glow, even though they have been hidden for years.",True,False,False,False,False,False,False,1,0
7229,arrows,"The arrow is so beat up and dirty, you can see indention's in it.",True,False,False,False,False,False,True,0,0
7231,bows,This bow has very detailed carvings,True,False,False,False,False,False,True,0,0
7277,thin sticks,Thin sticks that may be used to stoke a fire.,True,False,False,False,False,False,True,1,0
7319,sickle,"The handle has been worn from use, and the blade is old and caked with dirt. This is a real farmer's tool, not something that's been used as ornamentation.",True,False,False,False,False,False,True,0,0
7327,torture instrument,"The spike gleam wickedly and are flecked with dried blood on this torture implement.  You're not quite sure how it is used, but it looks painful.",True,False,False,False,False,False,True,0,0
7333,rustic tools,"Hand-held gadgets of the ""getting things done"" nature.",True,False,False,False,False,False,True,1,0
7359,cast iron skillets,"The black skillet is nicely seasoned, not showing any rusted spots.",True,False,False,False,False,True,True,0,0
7373,compass,The compass is shiny in the sun and felt warm to your touch. Your very survival depends on it for navigation in unknown lands.,True,False,False,False,False,False,True,0,0
7375,different types of swords,The sword has a clean sharp edge.  It is long and heavy.,True,False,False,False,False,False,True,0,0
7377,other types of weapons,The weapon is too heavy for you to lift and you wonder who it was made for.,True,False,False,False,False,False,True,0,0
7379,spare arrowheads,The arrowhead is designed to enter a person's body easily.,True,False,False,False,False,False,True,0,0
7387,body parts,The body part is covered in blood and is somewhat soft to the touch.,True,False,False,False,False,False,True,0,0
7411,stones with inscriptions on them,The stone has ancient ruins inscribed upon them.,True,False,False,False,False,False,True,0,0
7439,ice throne,The sword seems to be old but still reliable enough to cut down a animal.,True,False,False,False,False,False,False,0,0
7457,hammer,"Such an old hammer. Looks like the handle is about to break, there are several cracks in it. The metal part is still good",True,False,False,False,False,False,True,0,0
7459,nails,The nail is rusted and worn and is no longer useful.,True,False,False,False,False,False,True,0,0
7471,old broom,the broom is very dusty and fragile.,True,False,False,False,False,False,True,0,0
7491,quiver,"The quiver contains a mess of arrows, its leather frame stretched from years of use.",True,False,False,False,True,False,True,0,0
7493,bow,"The bow appears to be made of a dark brown wood, its string is taught and straight, and it is about as long as your arm.",True,False,False,False,False,False,True,0,0
7497,chairs,"Among numerous scratches on its surface, you can make out some marking.",True,False,False,False,False,True,False,0,0
