id,name,description,wieldable,wearable,food,drink,container,surface,carryable,assigned,annotated
7513,jug that holds the wine the servants fill glasses with,The jug is very useful for filling glasses of tea at dinner.,True,False,False,False,True,False,True,0,0
7521,old weapon,The weapon is crafted from pure silver and shines from ample polishing.  It looks like a dagger with a fancy sheath.,True,False,False,False,False,False,True,0,0
7523,"old machinery lying around, rusting",The machinery is obviously no longer in working condition,True,False,False,False,False,True,False,1,0
7529,hand cuffs,Cold metal cuffs that clang together loudly. You find yourself wondering who has been made to wear them before....,True,False,False,False,False,False,True,0,0
7535,stone that is ancient and antique with a shiny gloss of silver,"The stone is round and smooth, as if it has been polished.",True,False,False,False,False,False,True,0,0
7541,stones used on the entrance door,The stone is covered in blood,True,False,False,False,False,False,True,0,0
7583,spider legs,The pider leg is hairy and the sight of it makes you panic.,True,False,False,False,False,False,True,0,0
7589,scepter,"On its handle, you see two red gems gleaming like eyes of an animal.",True,False,False,False,False,False,True,0,0
7601,knife,The knife is clean and well polished.,True,False,False,False,False,False,True,0,0
7623,broom,This broom has never seen dirt. The straws are perfect and unscathed.,True,False,False,False,False,False,True,0,0
7647,tool,The tool has a metal surface and is very shiny.,True,False,False,False,False,False,True,0,0
7661,empty mug,The mug has been used for tea for a very long time.,True,False,False,False,True,False,True,0,0
7679,gold and silver sculptures,The sculpture shines brightly. A gleaming testament to the material it embodies.,True,False,False,False,False,False,False,0,0
7699,broken weapons,"This pike was broken in half at some point, and its point appears to be quite dull and rusty.",True,False,False,False,False,False,True,0,0
7709,primitive fishing pole,The fishing pole was splintered and worn.,True,False,False,False,False,False,True,0,0
7711,hatchet,The hatchet is old and worn out.,True,False,False,False,False,False,True,0,0
7729,product,This product is unque and a great peice of art.,True,False,True,True,False,False,True,0,0
7735,tools for keeping the cacti trimmed,Tools for keeping the cacti trimmed are necessary for any farmer of the desert.,True,False,False,False,False,False,True,0,0
7749,cobblestone,A stone often used to pave roads. Found in rivers. Water over the millenniums has worn away any sharp edges.,True,False,False,False,False,False,False,0,0
7759,farm tools,The farm tools look like they could use an update.,True,False,False,False,False,False,True,0,0
7777,old tools,"The tools are worn, showing their age, but still just as effective as the day they were welded.",True,False,False,False,False,False,True,0,0
7817,pole,the pole is long,True,False,False,False,False,False,True,0,0
7841,cooking instruments of every type,"This cooking instrument has some mold on it, the handle is breaking",True,False,False,False,False,False,True,0,0
7855,books,Illustrations of plants adorn the pages of the book. The lettering appears handwritten.,True,False,False,False,False,False,True,0,0
7977,rock,The rock is smooth and heavy.,True,False,False,False,False,False,True,0,0
8003,crosses,"The cross hangs proudly, solidly, projecting its peacefulness.  The aged, dark gray wood is hand-carved and lovingly oiled.",True,False,False,False,False,False,True,0,0
8027,axes,The axe has a chipped blade and the handle seems to be cracked towards the top.,True,False,False,False,False,False,True,0,0
8029,dagger,The dagger is curved with a golden hilt.,True,False,False,False,False,False,True,0,0
8035,broken fishing pole,The fishing pole is made of weak wood.  It has been broken in half.,True,False,False,False,False,False,True,0,0
8047,plate,The plate is crafted from pure gold and ivory.,True,False,False,False,False,True,True,0,0
8083,long table,The kitchen table has been used for dining for many years.,True,False,False,False,False,True,False,0,0
8087,blacksmith's hammer,"The hammer is made of sturdy iron, but is covered in a layer of rust.",True,False,False,False,False,False,True,0,0
8101,copper knives,A knife made out of copper. Doesn't rust but it's metal isn't as sturdy as something made out of other metals.,True,False,False,False,False,False,True,0,0
8103,copper forks,The fork is made of silver.,True,False,False,False,False,False,True,0,0
8109,shield,"The circular wooden shield has a leather rim and a striking metallic boss in the shape of a dragon's head, at the center.",True,False,False,False,False,False,True,0,0
8115,lance,The knight's lance has an edge that bears the palpable scars of battle.,True,False,False,False,False,False,True,0,0
8189,crosses,The large wooden cross is ornately carved. It has turned grey over time.,True,False,False,False,False,False,True,0,0
8217,maces,The mace is extremely heavy and has a large blunt head. It is stained with age and the handle is worn.,True,False,False,False,False,False,True,0,0
8219,keys,The key is old and tarnished. It is very small in size.,True,False,False,False,False,False,True,0,0
8235,torture equipment,The blood on the torture equipment shows recent use.,True,False,False,False,False,False,True,0,0
8243,torch,The torch sits aflame at the edge of the chambers below the castle.,True,False,False,False,False,False,True,0,0
8287,stained-glass window,The window is cracked but hasn't completely broken out.,True,False,False,False,False,False,False,0,0
8293,blades,The blade of a weapon with a honed edge. When attached to a hilt can be used for protection.,True,False,False,False,False,False,True,0,0
8299,rusty orange sandstone,the sandstone is rough and uneven.,True,False,False,False,False,False,False,0,0
8335,old broom,"The broom is starting to lose its bristles, and it's stained a dark brown color.",True,False,False,False,False,False,True,0,0
8343,bottle of wine,The bottle of wine seems tempting.,True,False,False,False,True,False,True,0,0
8387,bricks,The brick is so heavy.,True,False,False,False,False,False,True,0,0
8397,old half-buried swords,The sands of time as well as the earth have altered the state of these weapons. They are not terribly useful in their present state.,True,False,False,False,False,False,True,0,0
8401,traps,the trap has several strings.,True,False,False,False,False,False,True,0,0
8403,skinning knives,"The skinning knife has a thick dark brown coat of blood on it, and the handle is made of fine black leather.",True,False,False,False,False,False,True,0,0
8405,ivory spikes,These spikes clearly came from the tusks of a very large beast.,True,False,False,False,False,True,True,0,0
8411,expensive ornate dishes,This dish is very delicate and made of the finest chinet. It is embroidered with tiny blue flowers and gold edges.,True,False,False,False,False,False,True,0,0
8437,sea glass,"On its shiny surface, you see a name engraved.",True,False,False,False,False,False,True,0,0
8469,potions,The potion looks very dangerous.,True,False,False,True,False,False,True,0,0
8473,large ladle,A wooden dipping ladle for water or stew.,True,False,False,False,False,False,True,0,0
8499,small rocks,"Although small, this rock is sharp and hard enough that it can be used as a weapon.",True,False,False,False,False,False,True,0,0
8501,small fire,"The small fire provides a suitable cooking arrangement or a place for warmth, it's hot glowing embers burning a bright red.",True,False,False,False,False,True,False,0,0
8503,half-dozen coconuts,"The skin of the coconut is tough and stringy, its tender meat locked inside its tough shell.",True,False,True,True,False,False,True,0,0
8527,lighted torches,"The lit torch gives off a huge amount of smoke, and appears to be crafted hastily.",True,False,False,False,False,False,True,0,0
8529,five or so rocks,A plain old rock that one might find laying on the ground.,True,False,False,False,False,False,True,0,0
8553,plentiful torches,"The torch has a long handle, and looks like it will give off an impressively large flame when lit.",True,False,False,False,False,False,True,1,0
8569,poles with fire on top of them,The wooden pole is study with very few cracks and dings.,True,False,False,False,False,False,True,0,0
8579,leaning stack of pitchforks and scythes,A leaning stack of pitchforks and scythes seems conspicous to the goal the farmer.,True,False,False,False,False,False,True,0,0
8621,pick axe,The axe is poorly constructed and very dull from much use.,True,False,False,False,False,False,True,0,0
8649,big stones,This stones craving can still be interpreted.,True,False,False,False,False,False,True,0,0
8653,cannon,"The cannon is rusty, but still loaded.",True,False,False,False,False,False,True,0,0
8655,sword of the guards,The sword is sturdy and so heavy that you have trouble lifting it.,True,False,False,False,False,False,True,0,0
8677,prayer books,One book can change the world,True,False,False,False,False,False,True,0,0
8681,cooking pot,The cooking pot is rusted at the bottom and no longer usable,True,False,False,False,False,True,True,0,0
8683,witch's broom,"You suspect this broom was once wielded by a witch, as it gives off an air of power and electricity.",True,False,False,False,False,False,True,0,0
8687,grappling hook,The hook is rusty and has a sharp pointy end.,True,False,False,False,False,False,True,0,0
8699,stalactites,"The stalactite is very sharp, and somewhat bumpy to the touch.",True,False,False,False,False,False,True,0,0
8701,cannons,"The cannon is long and heavy, and luckily only needed in times of battle.",True,False,False,False,False,False,False,0,0
8711,pitch fork,"The pitch fork has a wooden handle and long, pointy, rusty tines.",True,False,False,False,False,False,True,0,0
8727,shattered windows,The shattered windows are made of stained glass. They lay on the ground and reflect light off them,True,False,False,False,False,False,False,0,0
8775,footstool,The footstool is decorated with an intricate floral design the likes of which you have never seen.,True,False,False,False,False,True,True,0,0
8785,variety of torture implements,the torture implements are very scary.,True,False,False,False,False,False,True,0,0
8795,herbs,"This herb is not edible, it looks poisonous but it's probably used to make some medicine",True,False,True,False,False,False,True,0,0
8815,bunch of knives,The knife has a long blade. It looks as though someone sharpened it recently.,True,False,False,False,False,False,True,0,0
8817,buckets of water,The bucket of water is dark and grimy. The wood holding it together has long since rotted.,True,False,False,True,True,False,True,0,0
8823,wood,Looks like the tree was struck by the lightening because the wood has a very unusual patterns,True,False,False,False,False,True,True,0,0
8827,axes,This axe is regal and made of the finest steel. The wood has a leather grip and and has steel wrapped around it's base.,True,False,False,False,False,False,True,0,0
8839,sword,"The sword is so old, it has cracks all in it.",True,False,False,False,False,False,True,0,0
8845,crops,"The crop was worn on the handle, and its length was covered in braided leather.",True,False,False,False,False,False,True,0,0
8857,hot poker,"The poker is ashen on the sharp end, from prior use.",True,False,False,False,False,False,True,0,0
8881,pickaxe,The pickaxe has a flimsy blade from too much use.,True,False,False,False,False,False,True,0,0
8891,royal staff,"This royal staff is ornately carved from the wood of a long forgotten enchanted tree.  It is gilded in the purest gold and a large, sparkling ruby winks at you in the light from the top of the staff, where it has been carefully affixed.",True,False,False,False,False,False,True,0,0
8903,chest plate,the plates are white in color,True,False,False,False,False,True,True,0,0
8909,sandals,the sandal had sand on it,True,False,False,False,False,True,True,0,0
8921,gavel,The gavel has a heavy blunt end and a firm handle.,True,False,False,False,False,False,True,0,0
8927,sharpened wooden stake,"The wood stake has a sharp end, it looks really dangerous. It looks new and its made out of a sankewood tree.",True,False,False,False,False,False,True,0,0
8929,hand spade,The spade is made of iron which makes its rather heavy. It is also quite rusty and several fragments from past use are stuck permanently on the spade.,True,False,False,False,False,False,True,1,0
8937,precious and unique stones,The stone is shiny and bright its strong and looks like its made out of bloodston and cavansite.,True,False,False,False,False,False,True,0,0
8955,catapults,The catapults appear to be made of sturdy timber and thick logs that are suitable for supporting heavy stone weights.,True,False,False,False,False,True,False,0,0
8985,barbs,This deadly spiked barb gleams wickedly in the light.  It looks quite sharp!,True,False,False,False,False,False,True,0,0
8987,scythe,the skythe is sharp and pointed,True,False,False,False,False,False,True,0,0
9005,trebuchets,You set up the trebuchet and marvel at its size.,True,False,False,False,False,False,False,1,0
9017,voodoo doll,The voodoo doll had needles all over it's small body. The doll gave the room a very eery feeling.,True,False,False,False,False,False,True,0,0
9043,tinder,"This can be used to make fire for cooking, or to create an explosive by filling a small container or vessel.",True,False,False,False,False,False,True,0,0
9061,fire poker,"The fire poker has an ashy end, it is clear it has been used for many years.",True,False,False,False,False,False,True,0,0
9075,tarot cards,"A plainly printed, slightly worn two of clubs.",True,False,False,False,False,False,True,1,0
9089,tomahawk,You hope the person who once wielded this tomahawk does not look as bloody as the stains memorialized on it.,True,False,False,False,False,False,False,0,0
9093,juggling balls,The juggling balls are the size of a human's palm. They are all bright green.,True,False,False,False,False,False,True,0,0
9097,chisel,"If you know how, you could create beautiful sculptures with this hardy chisel.",True,False,False,False,False,False,True,0,0
9099,pruning sheers,The pruning sheers were sharp and ready to cut.,True,False,False,False,False,False,True,0,0
9113,noose,The noose was sturdy and hung long from the tree.  You hope to never be in a position to see it up close.,True,False,False,False,False,False,True,0,0
9163,dart gun,The gun seems pieced together from several metal objects and other devices. It has a dark patina that would ensure its concealability.,True,False,False,False,True,False,True,0,0
9171,pipe,The pipe is about two feet in length and has threads on both ends where it has been meant to screw into something else. It is made of copper and has an aged patina.,True,False,False,False,True,False,True,1,0
9179,whiskey,"This bottle of whiskey is dusty, but appears to be of good quality. The glass and seal show detailed engravings.",True,False,False,True,False,False,True,0,0
9185,wooden sword,The wooden sword is four feet in length with a two inch wide blade.  The handle is dark and well used.,True,False,False,False,False,False,True,0,0
9189,hand ax,The hand ax is heavy with a long ornate handle. The head is well balanced and makes it easy to swing.,True,False,False,False,False,False,True,0,0
9193,umbrella stand,The stand is made of bronze and holds an umbrella inside it.,True,False,False,False,False,False,True,0,0
9195,canons,The canon looks quite menacing with its heavy black iron construction.  You wonder if there's a cannonball and gunpowder inside it...,True,False,False,False,True,False,False,1,0
9199,ghostly scythe,"The scythe has a razor sharp curved blade, polished to a ghostly silver sheen.",True,False,False,False,False,False,True,0,0
9205,crude net,The net appears to be in a crude state not yet fully assembled.,True,False,False,False,False,False,True,0,0
9227,walking stick,The walking stick has intricate shapes carved into it. It has a scene of tribal people dancing carved all around it.,True,False,False,False,False,False,True,0,0
9233,souvenirs of past battles,The souvenirs of past battles include a polished steel helm and a carved wooden drinking horn.,True,False,False,False,False,False,True,0,0
9249,pitcher,"The pitcher is heavier than it looks, and appears to still be in one piece.",True,False,False,False,False,False,True,0,0
9253,rolling pins,The rolling pin is covered in flour and splotches of dried dough.,True,False,False,False,False,False,True,0,0
9259,hand saw,The saw is small enough to be held in your hand.,True,False,False,False,False,False,True,0,0
9285,longsword,The longsword measures almost four feet in length and has a bronze handle with ornate carvings of a lions head and a dolphin.,True,False,False,False,False,False,True,0,0
9297,wooden staves,"The wooden staves are soft and moist, and may not be of much use.",True,False,False,False,False,False,True,1,0
9299,iron buckler,"The iron buckler has a large dent in it, and you can only wonder about the fierce battles it has been in.",True,False,False,False,False,False,True,0,0
9321,mallot,Upon closer inspection of the mallot it has some blood specs on it and appears very heavy.,True,False,False,False,False,False,True,0,0
9323,royal staff,The royal staff is gold and embellished with rubies.,True,False,False,False,False,False,True,0,0
9331,trident,"The trident is battered and worn, rusty on ends.",True,False,False,False,False,False,False,0,0
9341,shotgun,"The shotgun was well made, with a smooth wooden stock and shiny barrel.",True,False,False,False,False,False,True,1,0
9345,stone slab,A stone slab can be used to build walls. Stone slabs can be thrown for defense of the city.,True,False,False,False,False,True,True,0,0
9349,jeweled comb,the comb was oily and dirty,True,False,False,False,False,False,True,0,0
9353,damaged arrows,The arrow is damaged and bent.,True,False,False,False,False,False,True,0,0
9355,slingshot,The slingshot looks as though it's been used in combat as there is blood on the handle.,True,False,False,False,False,True,True,0,0
9377,golden broadsword,"A broadsword so wide and so golden that one could not help but notice it gleaming in the sunlight - even from a far distance, it is difficult to hide.",True,False,False,False,False,False,True,0,0
9403,sceptre,The sceptre is bright gold,True,False,False,False,False,False,True,1,0
9445,wand,"The wand is made out of wood, it is thin and has a sharp point. It has a dark brown wooden color.",True,False,False,False,False,False,True,0,0
9453,crude rolling pin,The pin was very crude in design but surprisingly didn't have any chips or damage,True,False,False,False,False,False,True,1,0
9515,platters,The platter is made of silver and has a few dents in it upon inspection.,True,False,False,False,False,False,True,0,0
9519,lyre,The lyre is mahogany in color and has several scratches on the body from years of use. It plays out of tune despite repeated attempts to correct it.,True,False,False,False,False,False,True,0,0
9559,meat cleaver,The cleaver has a dull edge with a worn wooden handle.,True,False,False,False,False,False,True,0,0
9571,pitcher of water,The pitcher is made of a shiny metal similar in appearance to stainless steel. It has a large pour spout and ornate handle.,True,False,False,False,True,False,True,0,0
9573,poison,The poison is ominously bubbling... you wouldn't want to be the person to drink this!,True,False,False,True,False,False,True,1,0
9587,"small dagger, badly damaged in skirmishes","This dagger has seen better days. It is worn considerably, and has clearly been used in many battles.",True,False,False,False,False,False,True,0,0
9617,spells,The spell is an old Latin phrase that allows for the conjuring of spectral entities,True,False,False,False,False,False,False,0,0
9619,various wands,"The wand is long. slim, and smooth to the touch.",True,False,False,False,False,False,True,0,0
9633,bo staffs,"The bo staffs are long and wooden, tied together by a leather cord. Some of the staffs have ancient runes on them.",True,False,False,False,False,False,True,0,0
9635,"small, but well-maintained farm plot",The plot is rusty on the sides and looks worned out. It looks old but at the same time strong and sturdy,True,False,False,False,False,False,True,0,0
9647,glasses,The glass looks beautiful and carefully crafted with symbol of sword and shield. It is suited for a king or a land lord.,True,False,False,False,True,True,False,0,0
9653,staff,The staff has intricate patterns and spells engraved into the pole along with a precious gem at the top,True,False,False,False,False,False,False,0,0
9663,fronds,"The palm fronds appear simple, but the branches and leaves are actually quite spiky and dangerous.",True,False,False,False,False,True,True,0,0
9677,musical instrument,The instrument has 6 chords and its made out of wood. It looks old and has stains of wine on the top.,True,False,False,False,False,False,True,0,0
9679,type of handcuff,These restraints would make sure whoever they hold captive could not get away.,True,False,False,False,False,False,False,0,0
9701,plate mail,The plate mail was old and rusty but still strong.,True,False,False,False,False,False,False,0,0
9705,chopping ax,The ax is good for chopping firewood.,True,False,False,False,False,False,True,0,0
9715,acid,The acid seems as if it could melt through wood and stone,True,False,False,False,False,False,False,0,0
9717,mighty hammer,"The hammer is a heavy item that has a wooden, beaten up handle. It is used hard by workers to build things.",True,False,False,False,False,False,True,0,0
9759,gold candle fixtures,The fixture in inlayed with gold and has a place for a candle.,True,False,False,False,True,True,False,0,0
9765,sharp seashell,The seashell has a spiral design and appears beige and white in color. It is larger on one end and comes to a point on the other.,True,False,False,False,False,False,True,0,0
9781,branding iron,The brandling iron can be heated until glowing.,True,False,False,False,False,False,True,1,0
9791,scimitar,The scimitar still glistens with the blood of its last victim.,True,False,False,False,False,False,True,1,0
9795,sliverware,"The silverware is nice and luxurious, its made out of gold and has a beautifull golden color.",True,False,False,False,False,False,True,0,0
9813,poison darts,The poison darts are small and very concealable.,True,False,False,False,False,False,True,2,0
9817,mallet,The iron head is mounted on a wooden handle that is well worn and has dark spots in the heavily used areas.,True,False,False,False,False,False,True,0,0
9827,spade,the spade is old and rusty,True,False,False,False,False,False,True,0,0
9893,cages,The cage is made for an animal of medium size such as a coyote or fox. The metal looks used but seems to have been cared for.,True,False,False,False,True,False,True,0,0
9895,lures,The lure is a metal object used in the sport of fishing. It is a metal hook or a similar metal object used to attract the fish to be caught.,True,False,False,False,True,True,True,0,0
9907,hail stones,The stone is created from hail so it is big and round.,True,False,False,False,False,False,True,0,0
9925,ball and chain,"The ball and chain has a very long chain, allowing an extended reach.",True,False,False,False,False,False,True,0,0
9949,scrap of metal that has been wielded into a mini sword,"Though it was once a scrap of metal, this is now a fine mini sword.",True,False,False,False,False,False,True,0,0
9973,scraper,The scraper is made of rusty iron.,True,False,False,False,False,False,True,0,0
9981,broken down wooden wagons,These broken wagons are rotting from being left in the rain and mud. There could be parts here that are useful.,True,False,False,False,True,True,True,0,0
9985,leather lunch pouch,the pouch is colorful and beautiful.,True,False,False,False,True,True,True,0,0
10015,scattered glass,The glass is broken in large shards. It is quite thick measuring around one inch in overall thickness.,True,False,False,False,False,True,True,0,0
10021,oil,"The oil was thick and plentiful in the lantern, and helped to illuminate the old tavern late into the evening.",True,False,False,False,False,False,True,0,0
10025,whip,"The whip is long and braided with shards of glass, and chunks of wood woven into it.  What a cruel punishment awaits the receiver of these lashes.",True,False,False,False,False,False,True,0,0
10059,ball and chain,these chains are one of a kind. Made of high end Dragon Scales of the mighty Fafnir which gives it a thicker link,True,False,False,False,False,False,True,0,0
10069,converse sneakers,The slippers are out of place and appear to be of an era that has not yet come.  They bare the image of a star on the sides.,True,True,False,False,False,False,True,0,0
10071,bejeweled dagger,this is a kind of a litle dagger but with ornaments like jewels,True,False,False,False,False,False,False,0,0
10077,magical items,"Various items, sizzling with energy. There is obviously a strong force around these object.",True,False,False,False,False,False,True,2,0
10083,claws,"His claws were sharp and deadly, ready to strike at a moments notice.",True,False,False,False,False,False,False,0,0
10099,animal skins,The animal skins were finely tanned and she wore them with pride.,True,True,False,False,False,True,True,1,0
10117,tools,"The tool has a wooden handle with leather wrapped around the handle, and a long wooden rod protrudes from the handle.",True,False,False,False,False,False,True,0,0
10121,thick leather belt,A fashionable yet thick and sturdy belt. Made of genuine leather by the town tanner.,True,True,False,False,False,False,True,0,0
10123,fist,The fist is large with scars and cuts on it.,True,False,False,False,True,False,False,0,0
