id,name,description,wieldable,wearable,food,drink,container,surface,carryable,assigned,annotated
10125,bouzoukis,His bouzoukis is finely tuned and plays beautifully when he strums it. The ornate pattern sprawled up the neck and is wonderfully unique.,True,False,False,False,False,True,True,0,0
10131,baton,"The baton is large, wooden, and a fierce red color.",True,False,False,False,False,False,True,0,0
10139,dull sword,The sword could hardly pierce anything due to its severe lack of an edge.,True,False,False,False,False,False,True,1,0
10145,dull knife,The knife is dull and useless.,True,False,False,False,False,False,True,0,0
10149,hard leather pads on elbows and knees,"these are new, extra comfortable and easy to install in the suit of armor",True,True,False,False,False,False,True,0,0
10161,throwing hammer,The hammer is long and lean with an aerodynamic body.,True,False,False,False,False,False,True,0,0
10165,jeweled knife,The knife is made from a very tough steel and two large beautiful emeralds set into handle,True,False,False,False,False,False,False,0,0
10171,small dagger,The dagger is small and can be easily concealed in a waist belt.  The handle is wrapped in leather straps to allow for a firm grip.,True,False,False,False,False,False,True,0,0
10173,black rock,"Upon further examinations this is no ordinary rock, but a black rock with a foreign inscription that appears to glow in the firelight.",True,False,False,False,False,True,True,0,0
10175,leather belt,The belt is made from well-tanned leather. It is quite strong while remaining supple.,True,True,False,False,False,False,True,0,0
10191,hidden dagger,"The dagger was small, it fit in the palm of your hand, it was easy to slip into a coat pocket if needed, It had a wooden handle with a small wood carving of a wolf on it.",True,False,False,False,False,False,False,0,0
10197,broken pistol,"The pistol is covered in blood and broken, possibly from being used in battle",True,False,False,False,False,False,True,0,0
10215,sturdy short sword,The sword is small and petite with a thick silvery center.,True,False,False,False,False,False,True,0,0
10217,club,The club is worn and features many dents.,True,False,False,False,False,False,True,1,0
10221,discarded looking sword,"The sword is obviously dull, worn and rusted.",True,False,False,False,False,False,True,0,0
10247,old sheathed knife,The knife is broken and covered in blood from a deadly battle.,True,False,False,False,False,False,True,1,0
10249,smithing materials,Shaping metal with a hammer (forging) is the archetypical component of smithing.,True,False,False,False,False,False,False,0,0
10251,garden tools,"this equipments  helps the garden to maintain, each euipment has each purposes it is very easy to carry and handle. It is also very easy to maintain the equipment rusting.",True,False,False,False,True,False,True,0,0
10263,knife,A deadly knife that has been recently sharpened to be like new.,True,False,False,False,False,False,True,0,0
10273,small telescope,The telescope is small and can be concealed in a waistcoat with ease.  Spying just got a whole lot easier.,True,False,False,False,False,False,False,0,0
10275,magic wand,The wand is made of gold and emits a white aura,True,False,False,False,False,False,True,0,0
10299,icey stalagmites and stalagtites,"A sharp stalagmite hanging from the roof of the cave, freezing to the touch.",True,False,False,False,False,False,True,1,0
10301,tusks,The tusks are made of pure ivory and there appears to be a mysterious marking in an unknown language printed on the sides.,True,False,False,False,True,False,True,0,0
10303,manacles,On the alleged torture and abusive treatment is manacles,True,False,False,False,True,False,True,0,0
10311,large swords,"Even from a distance the sword is larger than you are used to seeing, upon looking closer inscriptions and the honed edge of the blade are obvious.",True,False,False,False,False,False,True,0,0
10317,glass vial of some liquid,The vial is filled with a mysterious red liquid that reeks of ammonia.,True,False,False,False,True,False,True,0,0
10325,small ball of light,"glowing with such intensity, it is difficult to stare directly at the ball of light. Magic is required to wield this item.",True,False,False,False,True,False,True,0,0
10343,ordinary dagger,"a short knife with a pointed and edged blade, used as a weapon.",True,False,False,False,False,False,False,1,0
10355,sharp claws,The sharp claws of the dragon sliced through the armor of the knights.,True,False,False,False,False,False,False,0,0
10367,dwelling shoes,The pristine sole on the shoe with worn straps must mean that the shoe is only for use within the dwelling.,True,True,False,False,False,False,True,1,0
10375,cooking utensils,An old rusted set of various pots and pans.,True,False,False,False,False,False,True,0,0
10385,magelight,The magelight appears to be emitting a magical aura,True,False,False,False,False,False,True,0,0
10393,file for prying things open,"The file was made of heavy gray metal, with a rasp at one end and a comfortable handle at the other. It looked old and worn, it had seen many uses.",True,False,False,False,False,False,True,0,0
10399,shovel,The shovel is dirt-encrusted and grimy.,True,False,False,False,False,False,True,0,0
10401,gold cane,The gleaming cane was of immeasurable value.,True,False,False,False,False,False,True,0,0
10421,longbow,The longbow is sturdily built from yew and will give years of reliable service.,True,False,False,False,False,False,True,0,0
10433,spellbook,"The spellbook is old, thick, and dusty.",True,False,False,False,False,False,True,0,0
10439,silver cane,"This cane was detailed with carvings throughout the entire thing, this was no ordinary cane. It was one of a kind, something you could get a lot of money for if you were that type of person.",True,False,False,False,False,False,True,1,0
10451,stars,These hand-crafted throwing stars are sharp enough to cut with.,True,False,False,False,False,False,True,0,0
10469,winged darts,The darts are pointed and sharp with winged tips to guide them to their intended target.  But what is that?  A bit of dried blood is on the tip.,True,False,False,False,False,False,True,0,0
10483,bow,The bow is long and fashionably engraved.,True,False,False,False,False,False,True,0,0
10487,magical staff,The staff emanates magic as is glows a fluorescent shade of blue.,True,False,False,False,False,False,True,0,0
10499,riffle,The antique rifle is dull looking and not very well made but it will do the trick in a pinch when needed.,True,False,False,False,False,False,True,1,0
10501,hooks,"The hooks are tiny, dull, and tangled, and are of no use to anyone in this condition.",True,False,False,False,False,False,True,0,0
10503,small knife,"Sharp and hardened, this small knife glimmers in the light.",True,False,False,False,False,False,False,0,0
10535,smith's hammer,"The heavy hammer of the blacksmith is stained with black ash, and on the robust handle are the initials WR.",True,False,False,False,False,False,True,0,0
10553,chain,The chain is old and has rust covering it,True,False,False,False,False,False,True,0,0
10561,dragon crescent,The dragon crescent is a large and dangerous blade.,True,False,False,False,False,False,True,1,0
10563,royal armor,Exquisitely engraved metal armor. There is no mistaking it is meant for royalty.,True,True,False,False,False,False,True,0,0
10569,carved walking stick,The carvings in the walking stick are quite detailed in their design.,True,False,False,False,False,False,True,1,0
10579,boots,The bottom of the boot sunk into the mud like it was quicksand.,True,True,False,False,False,False,True,0,0
10601,beat up sword,"The beat up sword had seen many battles, but its greatest fight was yet to come.",True,False,False,False,False,False,True,0,0
10605,iron staff,The staff is heavy and shiny silver.,True,False,False,False,False,False,True,0,0
10607,tattered sandals,"The sandal was torn to shreds, upon inspection.",True,True,False,False,False,False,True,0,0
10625,few stray arrows,"Upon inspecting the arrow, it appears to be green in color and very sharp.",True,False,False,False,False,False,True,0,0
10629,large stick,The stick was large and sharp enough to be used as a spear,True,False,False,False,False,False,True,0,0
10633,pocket knife,The knife is small and incredibly sharp and serrated.,True,False,False,False,False,False,True,0,0
10635,iron chains,The chain appears old and have rusty bits attached to it,True,False,False,False,False,False,True,0,0
10643,thin dagger,The dagger is sharp and serrated.,True,False,False,False,False,False,True,0,0
10665,small sharp sword,"The sword was so small it was almost unnoticeable, but it was undeniably sharp.",True,False,False,False,False,False,True,2,0
10669,wizard staff,The arcane staff held power beyond comprehension.,True,False,False,False,False,False,True,0,0
10679,bow and arrows,The bow looks damaged and is covered in mold,True,False,False,False,False,False,True,0,0
10691,small guns,The gun is tattered and dull gray with rust.,True,False,False,False,True,False,True,1,0
10703,sharp sword,the sword can be kind of old but it is still very sharp,True,False,False,False,False,False,False,0,0
10725,bowstaff,The bowstaff is incredibly long and durable.,True,False,False,False,False,False,True,0,0
10729,unsharpened daggers,The dagger is incredibly dull and ugly.,True,False,False,False,False,False,True,1,0
10737,hard rock,"An ordinary rock, light enough to carry and heavy enough to dispatch a foe.",True,False,False,False,False,False,True,0,0
10745,wooden club,This wooden club is covered in blood and hair. It has definitely been used many times.,True,False,False,False,False,False,True,0,0
10751,pocket watch,His pocket watch was broken but still looked shiny and new.,True,False,False,False,False,False,True,1,0
10765,small swords,A small sword perfect for teaching the noble art of swordsmanship.,True,False,False,False,False,False,True,0,0
10787,huge broadsword,"This was a huge broadsword, not just any man could weild it because of it",True,False,False,False,False,False,True,0,0
10809,large club,The large club is rounded and battered.,True,False,False,False,False,False,True,0,0
10823,brass candle stick,The stick is shining gold and contains wax.,True,False,False,False,False,False,True,0,0
10825,zombies,"Object is a death and life with rotting skin and deformed, twisted facial features.  Object does not stand upright, but distorted. Object moves with a haggard gait and groans rather than speaks.",True,False,False,False,False,False,True,0,0
10831,orb,The orb looks harmless but the magic radiating from it makes the air fill with tension.,True,False,False,False,False,False,True,0,0
10839,"hungry, need food sign",The sign is a wooden plank nailed to a branch that reads hungry in red paint.,True,False,False,False,False,False,True,0,0
10855,axe,"The axe is rusty, perhaps from having sat out in the rain for too long.",True,False,False,False,False,False,True,2,0
10865,spike,Hence the renewed concern that the current spike could knock recovery off key.,True,False,False,False,False,False,False,0,0
10867,iron tool,The iron tool is holding it's own as most purchased iron tool.,True,False,False,False,False,False,False,0,0
10913,fiery dragon breath,The breath consumes its target with a fearsome quantity of flame.,True,False,False,False,False,False,False,1,0
10923,spoon,"The spoon is very small, made of silver and has the initial S engraved on the dainty handle.",True,False,False,False,True,True,True,0,0
10949,scythe,"The scythe is dull and dented, showing years of use.",True,False,False,False,False,False,False,0,0
10951,golden sword of kings,"on closer inspection, the sword has no edge for offense. A blacksmith is needed",True,False,False,False,False,False,False,1,0
10953,pitchfork,The pitchfork made for a great tool of defense.,True,False,False,False,False,False,True,0,0
11003,handkerchief,"A small piece of linen, silk, or other fabric, usually  in square, and used especially for wiping nose, eyes, face, etc., or for decorative purposes.",True,False,False,False,False,False,True,0,0
11007,spear,The spear was well used and had surely pierced the flesh of many unfortunate victims.,True,False,False,False,False,False,True,0,0
11019,needle,"a very fine slender piece of metal with a point at one end and a hole or eye for thread at the other, used in sewing.",True,False,False,False,False,False,False,0,0
11021,wooden sword,The best wooden sword made from japan,True,False,False,False,False,False,False,0,0
11025,faery wands,The wand is delicate and expertly crafted. Perhaps it was created by a species other than your own...,True,False,False,False,False,False,True,0,0
11027,wooden spoon,"The spoon is wooden and large, the perfect size for serving porridge or disciplining children.",True,False,False,False,False,True,True,1,0
11029,hammer,Too bad the hammer has a broken handle. It would be great for crushing fairies.,True,False,False,False,False,False,True,0,0
11031,superhero lunchbox,"the lunch box, one closer inspection, seems full of surprises. You never know what'll jump out at you once opened",True,False,False,False,True,False,True,0,0
11035,elven weapons,"The weapon is stained with blood, but appears to be broken and unusable",True,False,False,False,False,False,True,0,0
11041,walking stick,You can see that the hefty stick has a severely worn bottom from years of use.,True,False,False,False,False,True,True,0,0
11053,dull pocket knife,"The knife's edge is so worn, it could hardly cut through a hair.",True,False,False,False,False,False,True,0,0
11061,stick,This stick looks great for bashing goblins.,True,False,False,False,False,False,True,0,0
11063,rusted helmet,The helmet is old and silver with bouts of red rust along it.,True,True,False,False,False,False,True,0,0
11095,wand,"A wand appeared and with it, a very dark feeling. A feeling of dark magic.",True,False,False,False,False,False,True,1,0
11105,sharp scythe,The scythe was sharp and could cut with ease.,True,False,False,False,False,False,True,0,0
11121,gray stones,"A hard grey stone, you wouldn't think much of it due to how ordinary it is.",True,False,False,False,False,False,True,0,0
11123,dagger,"The dagger was small and concealed, ready to be drawn at the first sign of danger.",True,False,False,False,False,False,True,0,0
11133,grenades,The grenade has dirt on it.  It is black in color.,True,False,False,False,False,False,True,0,0
11143,bulletproof vest,"The item of clothing was bizarre and made of a strange material. It could best be described as a vest, but heavy and cumbersome.",True,True,False,False,False,False,True,0,0
11145,flame,The flame glistens a vibrant red.,True,False,False,False,False,False,False,0,0
11157,small knife (athame),The small knife (athame) is dull and has no edge.,True,False,False,False,False,False,True,1,0
11159,greaves,The greave is hardened and leathery.,True,True,False,False,False,False,False,0,0
11195,gun,The gun held power beyond anybody's comprehension.,True,False,False,False,False,False,True,0,0
11203,pads,"these pads are new, extra comfortable and easy to install in the leggings of armor",True,True,False,False,False,False,False,0,0
11211,leather shield,The shield was new and looks ravishing guarded in leather.,True,True,False,False,False,False,True,0,0
11229,raised fist,The raised fist is clenched and bloody with ragged finger nails and scrapes from the recent battle.,True,False,False,False,False,False,False,0,0
11237,trident,This trident is very beautiful but deadly,True,False,False,False,False,False,True,0,0
11239,ammo,The bolt is tipped with a vicious iron point.,True,False,False,False,False,False,False,0,0
11249,shield,The shield is wooden and beaten with a silver middle.,True,False,False,False,False,False,True,0,0
11271,sword,"A glimmering, well maintained sword is a sight to behold. You can see your reflection marveling at the gem studded hilt in the polished blade.",True,False,False,False,False,False,True,0,0
11281,knives,The knife was made of the finest steel and the blade had been freshly sharpened.,True,False,False,False,False,False,True,1,0
11289,igneous rock,"This was a large black rock, you could tell it came from a volcano, anyone who picked it up wanted to keep it, it was different looking, pretty almost.",True,False,False,False,False,False,True,0,0
11295,staff,A beautifully carved staff. A great deal of care went into crafting it.,True,False,False,False,False,False,True,0,0
11303,candle stick,"The candlestick is made of tarnished silver, and topped with a lighted candle that has melted down to the last few minutes of light.",True,False,False,False,True,False,True,0,0
11307,royal staff,"The royal staff is long, thin, and brown.",True,False,False,False,False,False,True,0,0
11311,ceremonial knife,The knife appears to have been used in ceremonies long since forgotten.,True,False,False,False,False,False,True,0,0
11315,drawing compass,His drawing compass is shiny and silver. It hold his drawing pencil firmly as he uses it.,True,False,False,False,True,False,True,0,0
11345,old sword,"The sword was old and worn, it had chips on the tip, rust was starting to form where the handle meets the blade but it could still be wielded without problem.",True,False,False,False,False,False,False,0,0
11349,helmet,The old helmet is covered in dents and what looks like to be some blood.,True,True,False,False,False,False,True,0,0
11365,rope,"The rope is long, tattered, and brown.",True,False,False,False,False,False,True,0,0
11389,rock,"The rock is large, dull, and ovular.",True,False,False,False,False,False,True,0,0
11395,torch,"The torch is hot, vibrant, and flaming.",True,False,False,False,False,False,True,0,0
11413,guitars,"The guitars are small with hand painted flowers on the front, but although they look pretty the sound is very out of tune.",True,False,False,False,False,False,True,0,0
11419,sheathed knife,The knife is shining and silver and within leather and cloths.,True,False,False,False,False,False,True,0,0
11421,thimble,"Buy the usual button for a bachelor, thimble for an old maid",True,False,False,False,False,False,False,1,0
11439,magical wand,Intricate carvings can be seen on the wand when held at certain angles.,True,False,False,False,False,False,True,0,0
11449,dragon scailmail,is an early form of armour consisting of many individual small armour scales of various shapes attached to each other and to a backing of cloth or leather in overlapping rows,True,False,False,False,False,False,False,0,0
11451,small wooden sword,"The sword was worn, battered and chipped like it has been used for many years, however it still had plenty of years use left.",True,False,False,False,False,False,True,0,0
11461,weapons,"The weapon is sharp and large, making it heavy to wield.",True,False,False,False,False,False,True,0,0
11471,chisel,The chisel appears worn from heavy use.,True,False,False,False,False,False,True,1,0
11485,rusted armor,The armor is thick and incredibly shiny silver.,True,False,False,False,False,False,True,0,0
11487,jeweled knives,The knife sparkles with jewelry and posits a deep purple glimmer.,True,False,False,False,False,False,True,0,0
11489,plumed helmet,The ornate helmet is made of iron and features a snazzy purple plume.,True,False,False,False,False,False,True,0,0
11493,money box,"She stumbled upon the solid metal item and while unhinging the latch, she discovered many schillings.",True,False,False,False,False,False,True,0,0
11497,of pencils,Upon looking at the matte black pencil it is in need of sharpening but it's pink gummy erasure is still intact.,True,False,False,False,False,False,True,0,0
11557,nails,The nail is old and rusted from being exposed to rain for too long,True,False,False,False,False,False,True,0,0
11565,sharp teeth,The tooth is sharp and white.  It is large and in good condition.,True,False,False,False,False,False,True,0,0
11571,small vile of poison,"Green with a feint smell, consuming this would be unwise.",True,False,False,True,False,False,True,0,0
11577,fire stoker,The fire stoker was much too heavy to wield as a weapon.,True,False,False,False,False,False,True,0,0
11591,big guns,"The gun is really big in size, and it have a lot power and accurate.",True,False,False,False,False,False,False,0,0
11601,quill pen,The feather on the pen is a dull gray color yet it's curled edges give it an almost fanciful quality.,True,False,False,False,False,False,True,0,0
11603,broken down splinters of wood,The splinter smells earthy and looks dark brown and in shambles,True,False,False,False,False,False,True,0,0
11633,gilt staff,"The staff is old and splintered in several areas, although it is no longer useful it carries sentimental value to the owner.",True,False,False,False,False,False,True,0,0
11671,oxygen tank,"A mysterious and shiny tank, containing an invisible substance.",True,False,False,False,False,False,True,0,0
11673,stone,The stone is appears to be really old and covered in moss,True,False,False,False,False,False,True,0,0
11681,big stick,The stick is large and has someone's initials carved into it.,True,False,False,False,False,False,True,0,0
11701,pickaxe,"The pickaxe looks to have been recently sharpened, glistening in the light on one end.",True,False,False,False,False,False,True,0,0
11703,skinning knife,This skinning knife still has bits of fur and blood on the blade.,True,False,False,False,False,False,True,0,0
11723,steel sword,The steel sword shines silver in the light.,True,False,False,False,False,False,True,0,0
11747,knight's suit of armor,"This suit of armor, made from metal, is made for a knight.",True,True,False,False,False,False,True,0,0
11759,sharp knives,The knife was sharp and pointy.,True,False,False,False,False,False,True,0,0
11761,stubby knife,"The knife was short, but it was thick. Perfect to use if you wanted to cut thick materials.",True,False,False,False,False,False,True,0,0
11765,scepter,"A large, thin scepter brims with vibrant white magic.",True,False,False,False,False,False,True,0,0
11785,lance,The lance seems sharp enough to pierce anything,True,False,False,False,False,False,True,0,0
11801,metal blades,The metal blades have contain sharp edge,True,False,False,False,False,False,False,0,0
11809,devil sticks,"Devil sticks, used for juggling simlar to a baton. This pair was constructed of wood and seemed to be well maintained.",True,False,False,False,False,False,True,0,0
11823,holy water,"Judging from the symbols on the vial, this water has been blessed by a priest.",True,False,False,False,False,False,True,0,0
11835,carving knife,This little knife is well suited to working on small wooden toys or totems. Don't let the size fool you; the blade is still plenty sharp.,True,False,False,False,False,False,True,0,0
11839,polished shield,The shield shines brightly given its highly reflective polish.,True,False,False,False,False,False,True,1,0
11845,broadsword,The broadsword is shiny and silver.,True,False,False,False,False,False,True,0,0
11853,grimores,The grimore emits a dark and evil aura when held.,True,False,False,False,False,False,True,0,0
11879,iron shackles,The shackle is made of iron and has a family crest painted on it.,True,False,False,False,False,False,True,0,0
11885,little shoes with curved toes,The tiny shoes are handcrafted in silk and have upturned toes.  A lady is not meant to walk in these dainty slippers.,True,True,False,False,True,False,True,0,0
11897,hatchet,The hatchet looks beaten up and scratched and has dried blood on it.,True,False,False,False,False,False,True,0,0
11917,arrows,"This arrow was made by hand, it was crafted very carfully with a peice of wood and sharpened, it includeded a sharply cut feather, this arrow was made by an fine archer.",True,False,False,False,False,False,False,0,0
11927,large rock,"This was a very heavy rock, someone could throw it but not if they had weak arms, It was a mix of browns and whites and little peices of it could come off if you tried to chip away at it.",True,False,False,False,False,False,True,0,0
11929,large quiver of arrows,"The quiver is equipped with two shoulder straps, it is made of  suede and leather uppers",True,False,False,False,False,False,False,0,0
